iyear,latitude,longitude,summary,crit1,crit2,crit3,attacktype1,gname,nkill2001,26.401436,90.266699,"08/01/2001: At least five people were killed and eight were injured when the vehicle they were traveling in drove over a landmine in Debatangi, Kokrajhar district, India.  The group was comprised of Bhutanese students and forestry officials.  Although no group claimed responsibility for the incident, authorities believed that the National Democratic Front of Bodoland (NDFB) was responsible.",1,1,1,3,National Democratic Front of Bodoland (NDFB),5
2001,44.216667,42.05,"08/01/2001: No one was injured when a bomb placed under a bridge in Cherkessk, Karachay-Cherkessia republic, Russia, detonated around 9:00am.  The bridge did not undergo serious damage as the bomb was not set up correctly.  No group claimed responsibility for the attack.",1,1,1,3,Unknown,0
2001,6.62139,122.143825,"08/02/2001: Abu Sayyaf Group (ASG) members launched a raid against the village of Balugo on the island of Basilan in the Philippines. During the course of the raid, several houses and a school were burnt down. ASG took 34 hostages, and beheaded four of them.",1,1,1,6,Abu Sayyaf Group (ASG),4
2001,35.873334,2.025519,"08/02/2001: Two policemen were shot and killed by unnamed Islamic extremists and a child was wounded in Theniet el-Had, Tissemselt province, Algeria.",1,1,1,2,Unknown,2
2001,-3.506203,29.460389,08/02/2001: Rebels were reported to have killed 13 civilians in the Bujumbura-Rural province of Burundi. Those killed were said to be sympathetic to the government.,1,1,1,2,Unknown,13
2001,54.662387,-6.217726,"08/02/2001: After an unidentified man claiming to speak for the Real IRA telephoned a warning, a car bomb was found in the Belfast International Airport in Northern Ireland. The bomb was successfully defused and no casualties were suffered in this incident.",1,1,1,3,Real Irish Republican Army (RIRA),0
2001,43.62945027,46.20243835,"08/02/2001: Chechen rebels kidnapped and killed a police chief, Lieutenant General Lom Ali Abduyev, and his son from their home. The pair were found with their throats slit on the road between the villages of Novyye Shchedriny and Staryye Shchedriny in Chechnya, Russia.",1,1,1,2,Chechen Rebels,2
2001,-3.383117,29.364451,"08/02/2001: Members of the National Liberation Forces-Icanzo (FNL-Icanzo) attacked the Heha District of Burundi. During the course of the raid, a number of shops and houses were destroyed. One person was killed and another was wounded by stray bullets.",1,1,1,2,Party for the Liberation of the Hutu People (PALIPEHUTU),1
2001,32.529407,75.694138,"08/02/2001: Suspected Islamic militants shot and wounded two Hindu sisters in the village of Pathie, Jammu and Kashmir, India.",1,1,1,2,Unknown,0
2001,33.778175,76.576171,"08/02/2001: Islamic militants shot and wounded Mukhtar Ahmed Hanji, near his house at Shams-ud-din Khan, Jammu and Kashmir, India.",1,1,1,2,Unknown,0
2001,34.552849,74.3508,"08/02/2001: Islamic militants intruded into the home of Muzaffar Ahmed Lone in Surigam, Kupwara district, Jammu and Kashmir, India, and dragged him to the village graveyard where he was killed.",1,1,1,2,Unknown,1
2001,34.05998,74.424533,"08/02/2001: Islamic militants shot and killed Mohammad Shafi Bhat near his home in Tangmarg, Jammu and Kashmir, India.",1,1,1,2,Unknown,1
2001,32.442482,35.496686,"08/02/2001: A Palestinian teenager entered an Israeli bus carrying a bag full of explosives near Tel Temoim Israel. The bomber was wrestled to the ground by the bus driver and other passengers, thwarting the attack.",1,1,1,0,Unaffiliated Individual(s),0
2001,31.294462,34.293284,"08/02/2001: Unidentified Palestinians fired three mortar rounds at a Jewish settlement in the southern Gaza Strip, Palestine. One woman was injured as a result of the attack.",1,1,1,3,Unknown,0
2001,-14.130054,14.49915,"08/02/2001: Members of the National Union for the Total Independence of Angola (UNITA) attacked Ngola commune in Huila province, Angola. Two people were killed and five were wounded in this incident. Damage was also inflicted on administrative infrastructures and caused people to flee the district.",1,1,1,2,National Union for the Total Independence of Angola (UNITA),2
2001,-1.206415,36.913794,"08/02/2001: Unidentified gunmen shot and killed Tony Ndilinge, a Kenyan African National Union (KANU) member of parliament, in Githurai, Makueni district, Kenya.  Sources suggested that the gunmen shot Ndilinge while they were all in Ndilinge's car.  Authorities initially thought the killing was the result of a robbery, but they later discarded this theory as Ndilinge was found with money and other personal belongings.  No group claimed responsibility for the attack.",1,1,1,1,Unknown,1
2001,36.587465,3.779068,"8/2/2001: Unknown perpetrators, believed to be affiliated with the Islamic insurgency in Algeria, detonated a homemade bomb on National Road 48 targeting a vehicle carrying Algerian soldiers in Tizi Ghenif, Algeria.  Two soldiers were wounded and their vehicle was damaged.",1,1,0,3,Algerian Islamic Extremists,0
2001,51.513351,-0.304214,"08/02/2001: The Real IRA detonated a car bomb near the Ealing subway station in west London, next to a busy commercial area on Uxbridge Road. Seven people were wounded in this incident.",1,1,1,3,Real Irish Republican Army (RIRA),0
2001,31.640992,35.143089,08/02/2001: Palestinian gunmen fired on the settlement of Migal Oz in the Etyzon Bloc in the West Bank. No one was injured in the attack.,1,1,1,2,Unknown,0
2001,54.597269,-5.930109,08/03/2001: Five primed pipe bombs and a coffee jar device placed by the Ulster Defence Association/Ulster Freedom Fighters were found and defused by police at a north Belfast playing field in Northern Ireland.,1,1,1,3,Ulster Freedom Fighters (UFF),0
2001,10.502961,-66.917253,08/03/2001: A bomb was found and defused in the Caracas home of former Venezuelan president Carlos Andres Perez.,1,1,1,3,Unknown,0
2001,43.34592232,46.66223809,"08/03/2001: A powerful explosive device consisting of six anti-aircraft shells, a hand grenade and 200 grams of plastic was discovered near the railway bed of the Khasavyurt-Karlanyurt stage of the North-Caucasian Railway in Dagestan, Russia. The homemade explosive was successfully defused.",1,1,1,3,Unknown,0
2001,41.846517,8.760627,"08/03/2001: The National Liberation Front of Corsica (FLNC) placed an explosive device in a home in Isolella, Corsica, France. The device was found and defused, causing no injuries.",1,1,1,3,Corsican National Liberation Front (FLNC),0
2001,43.26763,46.27991,"08/03/2001: Three Russian police officers were killed when a bomb detonated in the abandoned vehicle they were inspecting near a gas station in the Gudermes region of Chechnya, Russia.",1,1,1,3,Chechen Rebels,3
2001,41.591369,9.278311,"08/03/2001: A bomb was found and defused at a gendarmerie post near Porto-Vecchio in Corsica, France. The National Liberation Front of Corsica claimed responsibility. No injuries resulted from this incident",1,1,1,3,Corsican National Liberation Front (FLNC),0
2001,31.532569,35.099826,"08/03/2001: Unidentified Palestinians threw petrol bombs at a border police checkpoint in Hebron, the West Bank. No casualties were suffered in this attack.",1,1,1,2,Unknown,0
2001,43.316667,45.683333,"08/03/2001: Chechen rebels ambushed a police convoy in the Shelkovsky district of Grozny. This convoy was sent to investigate the murder of Shelkovskaya police chief Lt-Col Lom-Ali Abduyev and his son, also a policeman, in the same district the previous day. At least one policemen was killed in the attack.",1,1,1,2,Chechen Rebels,12
2001,31.583585,34.502604,08/03/2001: Unidentified Palestinians fired two mortar rounds at the Jewish settlement of Eley Sinay in the northern Gaza Strip. No casualties were suffered in this attack.,1,1,1,3,Unknown,0
2001,42.830941,-1.608777,"08/04/2001: An incendiary device started a fire at the dry-cleaning business owned by the family of the Union of the Navarrese People councilor (UPN), Juan Francisco Eransus. The attack occurred in Villava, Navarre Autonomous Community, Spain. No casualties resulted from this attack.",1,1,1,7,Unknown,0
2001,42.669927,-2.030906,"08/04/2001: In Estella, Navarre, Spain, five petrol bombs were thrown by unknown hooded assailants into the third and fourth floors of the rear of the Estella Civil Guard barracks, which backs on to the Plaza de San Miguel. The devices sparked a fire that completely burnt out one of the residential quarters. Another two residential quarters were also affected by the flames. No casualties resulted from this attack.",1,1,1,7,Unknown,0
2001,33.778175,76.576171,"08/04/2001: Twenty-two Hindu shepherds were abducted by suspected members of Lashkar-e Taiba from the village of Shrotidar in Jammu and Kashmir, India. The victims were marched into the woods and shot. Thirteen died, two escaped, and seven were wounded in this incident.",1,1,1,2,Lashkar-e-Taiba (LeT),13
2001,33.717003,74.836092,"08/04/2001: A shopkeeper, Bilal Ahmad Dar, was shot and killed by Islamic militants in Shopian, Jammu and Kashmir, India.",1,1,1,2,Unknown,1
2001,32.283664,35.125205,08/05/2001: A Palestinian militant was shot and killed by Israeli soldiers while placing an explosive device at the settlement of Einav near Tulkarem in the West Bank.  Another perpetrator was shot and wounded but escaped into territory controlled by the Palestinian Authority.,1,1,1,3,Unknown,1
2001,-0.181439,-78.467266,"08/05/2001: An unknown number of explosives were placed at a branch of the state-owned Filanbanco in Quito, Ecuador by unidentified perpetrators. Of six bombs placed in four branches throughout the country, only three exploded, causing minor property damage and no injuries.",1,1,1,3,Unknown,0
2001,-2.170832,-79.922359,"08/05/2001: An unknown number of explosives were placed at a branch of the state-owned Filanbanco in Guayaquil, Ecuador by unidentified perpetrators. Of six bombs placed in four branches throughout the country, only three exploded, causing minor property damage and no injuries.",1,1,1,3,Unknown,0
2001,-2.90008,-79.005896,"08/05/2001: An unknown number of explosives were placed at a branch of the state-owned Filanbanco in Cuenca, Ecuador by unidentified perpetrators. Of six bombs placed in four branches throughout the country, only three exploded, causing minor property damage and no injuries.",1,1,1,3,Unknown,0
2001,-1.056085,-80.455278,"08/05/2001: An unknown number of explosives were placed at a branch of the state-owned Filanbanco in Portoviejo, Ecuador by unidentified perpetrators. Of six bombs placed in four branches throughout the country, only three exploded, causing minor property damage and no injuries.",1,1,1,3,Unknown,0
2001,-3.943417,29.62056,"08/05/2001: A boat sailing from Congo to Uvira, Burundi was hijacked by the National Council for the Defense of Democracy and the Mayi Mayi on Lake Ganganyika near Kazimia, Burundi and the people aboard were taken hostage. No injuries were reported to have occurred during the hijacking.",1,1,1,4,National Council for Defense of Democracy (NCDD),0
2001,54.597269,-5.930109,"08/05/2001: A crude bomb went off at Rosemount Gardens in north Belfast, Northern Ireland. No one was injured, but the explosion caused slight damage to the wall of a house.",1,1,1,3,Unknown,0
2001,32.189283,34.971503,"08/05/2001: Unidentified Palestinian gunmen opened fire on a civilian vehicle after it had crossed from Israel into the West Bank, Palestine. An Israeli woman was killed, and her husband and daughter were severely wounded.",1,1,1,2,Unknown,0
2001,32.085305,34.785769,"08/05/2001: A lone Palestinian gunman, Ali al Jolani, attacked the Defense Ministry building in Tel Aviv, Israel in a drive-by shooting. Eight soldiers and two civilians were wounded and al Jolani was shot and later died. He was suspected of being a member of HAMAS or Palestinian Islamic Jihad (PIJ).",1,1,1,2,Hamas (Islamic Resistance Movement),1
2001,43.320664,-3.020252,"08/05/2001: An unidentified group wearing balaclavas bombarded a bank in Portugalete, Biscay province in Spanish Basque Country with petrol bombs, damaging the building. No injuries resulted from this attack, which was suspected to have been perpetrated by Euskadi ta Askatasuna (ETA) sympathizers.",1,1,1,7,Unknown,0
2001,43.320664,-3.020252,"08/05/2001: A firebomb attack injured two Basque police officers in an ambush by unidentified hooded assailants in Portugalet, Biscay province. Spain. The two victims were injured with serious burns. The assailants were suspected supporters of Euskadi ta Askatasuna (ETA).",1,1,1,2,Unknown,0
2001,43.265982,-2.497192,"08/05/2001: A post office and cash machines in the Basque village of Markina, Biscay province, Spain were attacked with Molotov cocktails.  No injuries resulted from this attack, which was suspected to have been perpetrated by Euskadi ta Askatasuna (ETA) sympathizers.",1,1,1,7,Unknown,0
2001,42.421923,21.420165,"08/05/2001: Five ethnic Serbs were injured when a hand grenade was thrown by unknown persons in a yard behind the village church in Cernica, Kosovo, Federal Republic of Yugoslavia (FRY).",1,1,1,3,Unknown,0
2001,31.403091,34.369053,"08/05/2001: Palestinian militants fired 26 mortar rounds at Jewish settlements and army outposts in the Gaza Strip, Palestine. One of the mortars wounded two people, a father and son, at the isolated Jewish settlement of Kfar Darom.",1,1,1,3,Unknown,0
2001,36.542194,2.30415,"08/05/2001: A roadside bomb targeting an Algerian police patrol detonated in Sidi Amar, Tipasa province, Algeria, causing one death and two injuries. Unidentified Islamic militants were blamed for the attack.",1,1,1,3,Unknown,1
2001,35.126111,0.445833,"08/05/2001: Four shepherds were abducted by armed Islamic militants in Ghrous, Biskra province, Algeria. The bodies were found with evidence of torture on August 6, 2001 and their throats slit. Additionally, the shepherds' herd was stolen.",1,1,1,2,Unknown,4
2001,9.999547,29.398746,"08/05/2001: Members of the Sudanese People's Liberation Army (SPLA) attacked oil production facilities of the Talisman Energy Corporation, a Canadian firm, in Heglig, West Kurdufan, Sudan. Oil production was briefly suspended and equipment was destroyed, but No injuries resulted from this incident",1,1,1,2,Sudan People's Liberation Army (SPLA),0
2001,7.060051,-73.853115,"08/05/2001: Approximately 25,000 people were left without telephone service after a group of unidentified armed men blew up two Telecom exchange boxes in the Lz Esperanza neighborhood of Barrancabermeja, Santander Department, Colombia. No casualties resulted from the attack.",1,1,1,3,Unknown,0
2001,7.060051,-73.853115,"08/05/2001: Approximately 25,000 people were left without telephone service after a group of unidentified armed men blew up a Telecom exchange box in the Primero de Mayo neighborhood of Barrancabermeja, Santander Department, Colombia. No casualties resulted from the attack.",1,1,1,3,Unknown,0
2001,7.060051,-73.853115,"08/05/2001: Approximately 25,000 people were left without telephone service after a group of unidentified armed men blew up a Telecom exchange box in the Alcazar neighborhood of Barrancabermeja, Santander Department, Colombia. No casualties resulted from the attack.",1,1,1,3,Unknown,0
2001,4.527142,97.607574,"08/05/2001: Three employees of a relay station for the state-owned television station TVRI were kidnapped by members of the Free Aceh Movement (GAM) in the East Aceh Regency of Aceh Province, Indonesia. The three technicians were traveling to Medan, capital of North Sumatra Province, by bus when they were taken by a group of men at a roadblock.",1,1,1,6,Free Aceh Movement (GAM),0
2001,34.071834,74.647046,"08/05/2001: Suspected Islamic militants shot and killed a village chief in Watalpora, Jammu and Kashmir, India.",1,1,1,1,Unknown,1
2001,1.66872,-77.01234,"08/05/2001: Argemiro Medina Amaya, the Community Action Board President of San Pablo, Colombia, was shot and killed in a raid by the United Self Defense Forces of Colombia (AUC).",1,1,1,1,United Self Defense Units of Colombia (AUC),1
2001,26.54257,90.474846,"08/05/2001: Six soldiers from the Central Reserve Police Force were killed and one was injured by a powerful bomb that exploded at Baur Bazaar in the Bongaigaon District of Assam State, India. Suspected National Democratic Front of Bodoland militants detonated the improvised explosive device (IED) as the soldiers passed the area. The convoy was traveling from Amguri to Bongaigaon at the time of the attack.",1,1,1,3,National Democratic Front of Bodoland (NDFB),6
2001,33.14575,75.548049,"08/05/2001: At least eighteen male Hindu villagers from Atholi, India, were kidnapped by a group of at least twelve militants and taken to Luddar village, Doda district, India, were at least fifteen villagers were shot and killed.  Three of the villagers escaped.  Although no group claimed responsibility, authorities blamed the Lashkar-e-Taiba organization, which denied the allegations.",1,1,1,6,Militants,15
2001,43.15,45.9,"08/06/2001: Chechen rebels launched an assassination attempt on Russian Doguyev, the Deputy Governor of Shali district in Chechnya, Russia. Doguyev, who was severely injured, was driving in his car in Shali when the attack occurred.",1,1,1,1,Chechen Rebels,0
2001,7.060051,-73.853115,"08/06/2001: Major Jhon Fredy Rios, a police commander, was shot and wounded from a passing taxi in a presumed United Self Defense Forces of Colombia (AUC) attack as he was walking along the El Recreo neighborhood of Barrancabermeja, Colombia dressed in civilian clothes. A civilian was also injured in this attack.",1,1,1,1,United Self Defense Units of Colombia (AUC),0
2001,23.179301,75.78491,"08/06/2001: A 30-year-old nun, Leena Veena, was shot and seriously wounded by four unidentified attackers on a motorcycle in Ujjain, Madhya Pradesh state, India. Veena was shopping with another nun, Sister Anupa, who was uninjured.",0,1,1,2,Unknown,0
2001,19.075984,72.877656,"08/06/2001: Father Oscar Mendonca of St John the Baptist Church was assaulted by members of Bajrang Dal, in the outskirts of Mumbai, India. Bajrang Dal was conducting a memorial procession when the attack occurred. Twenty-five of the members forced their way into St. John the Baptist Church and beat Father Mendonca.",1,1,1,8,Vishwa Hindu Parishad (VHP),0
2001,-4.342097,29.599754,"08/06/2001: A Hutu rebel attack on the Kazirabageni refugee camp in Nyanza-Lac Commune, Makamba province, Burundi killed one person.",1,1,1,2,Unknown,1
2001,8.79996,-74.61666,"08/06/2007: Eight members of the Ejercito Revolucionario del Pueblo (ERP) kidnapped six people from Cordoba Corregimiento, Sucre department, Colombia, using a red Ford 350 truck driven by Santiago Cuello Chamorro, who was intimidated into helping the rebels.",1,1,1,6,People's Revolutionary Army (ERP),0
2001,8.809894,-74.616688,"08/06/2007: Eight members of the Ejercito Revolucionario del Pueblo (ERP) kidnapped three people from Arboleda Corregimiento, Sucre department, Colombia, using a red Ford 350 truck driven by Santiago Cuello Chamorro, who was intimidated into helping the rebels.",1,1,1,6,People's Revolutionary Army (ERP),0
2001,8.8833,-74.7,"08/06/2001: Eight members of the Ejercito Revolucionario del Pueblo (ERP) kidnapped three people from San Luis Corregimiento, Sucre department, Colombia, using a red Ford 350 truck driven by Santiago Cuello Chamorro, who was intimidated into helping the rebels.",1,1,1,6,People's Revolutionary Army (ERP),0
2001,-7.289166,112.734398,"08/07/2001: A bomb outside the residence of Nailul Aryati detonated, killing her and wounding a nearby vendor, in Surabaya, East Java province, Indonesia.  The home was seriously damaged.  No group claimed responsibility, although police did hold at least ten witnesses for questioning, including the injured vendor.",1,1,1,3,Unknown,1
2001,34.303162,75.293111,"08/07/2001: Lashkar-e-Jhangvi (LeJ) members threw acid on two female school teachers, who were attacked when they were returning from a picnic in Sonmarg, Jammu and Kashmir, India. One of them received severe burns on her face and chest.",1,1,1,8,Lashkar-e-Jhangvi,0
2001,35.685826,139.756684,"08/07/2001: Unknown perpetrators set off an explosive device in a lot adjacent to the office of the Japanese Society for History Textbook Reform in Tokyo, Japan. A fire was started, resulting in minor property damage. No injuries resulted from this incident.",1,1,1,3,Unknown,0
2001,34.083658,74.797368,"08/07/2001: Lashkar-e-Jhangvi (LeJ) claimed responsibility for an acid attack on two school girls outside their home in Srinagar, Jammu and Kashmir, India. The face of one girl, Kulsooma, was badly charred as a result of this incident.",1,1,1,8,Lashkar-e-Jhangvi,0
2001,41.980342,21.060944,"08/07/2001: The National Liberation Army (Macedonia) abducted five Macedonian civilians near Zilino, Macedonia. The victims were doing roadwork when the attack occurred. They were released on August 8, 2001.",1,1,1,6,National Liberation Army (NLA) (Macedonia),0
2001,5.657909,-75.837417,"08/07/2001: Two civilians were kidnapped at a roadblock near Canavera, Antioguia department in Colombia. The incident was a presumed Revolutionary Armed Forces of Colombia (FARC) attack.",1,1,1,6,Revolutionary Armed Forces of Colombia (FARC),0
2001,32.197318,35.008912,"08/07/2001: An Israeli Arab, Wael Ghanem, was shot and killed by unidentified gunmen while traveling by car to the Israeli settlement of Tzofin in the West Bank, Palestine.",1,1,1,2,Unknown,1
2001,31.950001,35.933331,"08/07/2001: An Israeli businessman, Yitzhak Snir, was shot and killed in Amman, Jordan in an attack claimed by the Nobles of Jordan.",1,1,1,1,Nobles of Jordan,1
2001,32.062722,35.474306,"08/07/2001: A senior Israeli police officer was shot at near the settlement of Yafit in the West Bank, Palestine by unknown assailants No injuries were suffered by the officer.",1,1,1,1,Unknown,0
2001,33.254429,35.542461,"08/07/2001: The abandoned homes of Robin Abboud and Samir Raslan, former members of the South Lebanon Army (SLA), were destroyed in explosions in Aadaysee, Lebanon in a suspected Hizballah attack. No injuries were reported in connection with this incident.",1,1,1,3,Hezbollah,0
2001,6.96316,-75.41732,"08/07/2001: Three people were kidnapped by members of the National Liberation Army (ELN) at a roadblock between the towns of Yarumall and Angostura in Antioquia department Colombia. The hostages were local residents on a business trip to Medellin, Colombia.",1,1,1,6,National Liberation Army of Colombia (ELN),0
2001,4.527142,97.607574,"08/07/2001: A woman was abducted by a group of suspected Free Aceh Movement (GAM) members while she was working in the fields. The body of the woman was found in the Banta Yan river in East Aceh Regency, Aceh province, Indonesia, the next day. The woman's home was also torched. A spokesman for the Free Aceh Movement (GAM) denied responsibility for the attack on the woman.",1,1,1,6,Free Aceh Movement (GAM),1
2001,5.166216,96.357154,"08/07/2001: A spokesman for the Free Aceh Movement (GAM) claimed that members of the group shot and killed four policemen in an ambush on a military truck in Batee Illiek, Aceh province, Indonesia.",1,1,1,2,Free Aceh Movement (GAM),4
2001,42.90555036,21.16810073,"08/07/2001: A convoy of four ethnic Serb vehicles was fired upon by unknown gunmen near the town of Pojojevo in Kosovo, Federal Republic of Yugoslavia (FRY). At least three people were wounded in this incident.",1,1,1,2,Unknown,0
2001,34.205141,74.349494,"08/07/2001: Islamic militants shot at a home in Baramula District in Jammu and Kashmir, India. One person was wounded in the attack.",1,1,1,2,Unknown,0
2001,33.883072,74.920877,"08/07/2001: Islamic militants shot at a home in Pulwama District in Jammu and Kashmir, India. One person was wounded in the attack.",1,1,1,2,Unknown,0
2001,34.587222,74.243333,"08/07/2001: Islamic militants shot and killed a woman in her home in Bundagam, Badgam District, Jammu and Kashmir, India.",1,1,1,2,Unknown,1
2001,32.726602,74.857026,"08/07/2001: Three Islamic militants launched a shooting attack against people at the Jammu Railway Station in Jammu, Jammu and Kashmir State, India. 11 were killed and at least 30 injured. The perpetrators sprayed a carriage packed with combat troops heading for Srinagar, Jammu and Kashmir, and other passengers waiting for their trains",1,1,1,2,Unknown,12
2001,7.79139,126.45333,"08/08/2001: A failed assassination attempt was launched on the governor of Compostella Valley province, Jose Caballero, by the New People’s Army (NPA) near Catiil, Philippines while traveling by convoy. Two police escorts were killed and two others were seriously wounded.",1,1,1,1,New People's Army (NPA),2
2001,19.432608,-99.133207,"08/08/2001: A bomb exploded outside of a Banamex bank branch in Mexico City, Mexico. Two other branches were also attacked in a similar fashion. Authorities managed to defuse another bomb that was set to explode. One person was lightly wounded in the attack, which was claimed by the Fuerzas Armadas Revolucionarias del Pueblo (FARP).",1,1,1,3,Fuerzas Armadas Revolucionarias del Pueblo (FARP),0
2001,41.387917,2.169919,"08/08/2001: Two bombs placed by unidentified perpetrators exploded within fifteen minutes of each other at the Plaza de Castilla in Barcelona, Spain. One person was wounded in the first explosion. Police said the explosions were probably the work of young anti-authority militants who were active in Barcelona.",1,1,1,3,Unknown,0
