iyear,latitude,longitude,summary,crit1,crit2,crit3,attacktype1,gname,nkill2001,33.778175,76.576171,"03/17/2001: Unidentified gunmen shot Ghulam Mohammad Ganai, National Conference block president, in his home around 9:45pm in Kulipora village, Kashmir region, India.  Ganai later died from his injuries.  A police officer, Abdul Majid, was wounded in the shooting.  No group claimed responsibility for the attack although sources blame suspected militants.",1,1,1,1,Militants,1
2001,6.660497,122.140811,"03/18/2001: Six suspected members of the Abu Sayyaf Group (ASG) shot and killed a government doctor, Pilardo Perez, in an attack near Lamitan, Philippines. The attackers also abducted a village chieftain, Buvinto Mclinto, during the attack. No group claimed responsibility for the attack.",1,1,1,2,Abu Sayyaf Group (ASG),1
2001,0.066857,30.065281,"03/18/2001: 20 to 30 members of the Allied Democratic Forces (ADF) attacked the western Ugandan town of Kasese, killing 11 people and injuring six others. The attackers first struck the local police barracks at the edge of the town. They then set two gas stations on fire and burned around 50 vehicles during the attack. The perpetrators left a note indicating that the ADF had attacked the town because Kasese residents had voted for President Yoweri Museveni during presidential elections held on March 12, 2001. The leaflet was signed by Mulobelyo, the ADF's Operations Commander. Three ADF rebels were killed in the fighting as well.",1,1,1,2,Allied Democratic Forces (ADF),11
2001,26.613806,91.740436,"03/18/2001: Members of the National Democratic Front of Bodoland (NDFB), shot and killed six Adivasi Santhal tribal farmers and wounded another five in Ramgaon village, in the state of Assam, India.  The group did not claim responsibility for the attack.",1,1,1,2,National Democratic Front of Bodoland (NDFB),6
2001,-2.533333,112.95,"03/18/2001: The bodies of eight Madurese men who were hiding in a forest were found dead after they had briefly come out of hiding to get food and check on their homes in Sampit, Central Kalimantan province, Borneo, Indonesia.  At least one of the men had been decapitated.  Authorities said that individuals belonging to Dayak gangs were responsible for the killings, although no claim of responsibility was made.",1,1,1,9,Dayak gang,8
2001,54.999061,-6.332559,"03/18/2001: Unidentified gunmen shot into a home with a shotgun near midnight in Cloughmills, Ulster province, Northern Ireland.  Three children were home alone at the time.  Although no group claimed responsibility for the attack, the children's parents later blamed sectarians for the incident, claiming they were singled out because of their Catholic faith.",1,1,1,2,Unknown,0
2001,31.676301,35.143348,"03/19/2001: An Israeli civilian was killed in a shooting attack while in his car as he was driving north of Neve Daniyel, West Bank. After being shot, the man lost control of his vehicle and collided with a truck. No group claimed responsibility for the shooting.",1,1,1,2,Unknown,1
2001,4.092517,-75.154538,"03/19/2001: A German businessman was kidnapped by about twenty suspected leftist rebels in Tolima, Colombia. The outcome of the kidnapping was unknown. No group claimed responsibility for the kidnapping.",1,1,1,6,Left-Wing Extremists,0
2001,8.002581,124.292973,"03/19/2001: Three Filipino Marines were wounded by a grenade attack perpetrated suspected members of the Moro Islamic Liberation Front (MILF) in the Province of Lanao del Sur, on the southern Philippine island of Mindanao. No group claimed responsibility for the attack.",1,1,1,3,Moro Islamic Liberation Front (MILF),0
2001,5.554139,95.316668,"03/19/2001: Suspected Free Aceh Movement rebels shot a policeman, private Bakri, in his car in Banda Aceh, Indonesia.",1,1,1,2,Free Aceh Movement (GAM),1
2001,42.4392,19.266,"03/19/2001: A car bomb suspected to be connected to a timer exploded outside of the Montenegrin Justice and Education Ministries building around 8:00pm in Podgorica, Montenegro.  The owner of the vehicle, Milan Radulovic, was killed in the explosion.  No group claimed responsibility for the attack.  A judge with the high court opened an investigation at the site of the incident.",1,1,1,3,Unknown,1
2001,-34.594722,-58.375833,"03/19/2001: A homemade pamphlet bomb exploded at 4:30am outside the headquarters of the Latin American Economic Research Foundation (FIEL), a non-profit organization, in the Retiro neighborhood of Buenos Aires, Argentina.  The newly-appointed Argentinian Economic Minister used to work in the headquarters office.  An unknown group called the Rodolfo Walsh National Command claimed responsibility for the incident in the pamphlets that were strewn around the area after the explosion.  No one was injured in the explosion, although the glass windows of the FIEL headquarters were shattered.",1,1,1,3,Rodolfo Walsh National Command,0
2001,43.35,46.1,"03/20/2001: Three Chechen militiamen were injured in Gudermes, Chechnya, when their car was blown up by a land mine placed by suspected Chechen rebels. No group claimed responsibility for the attack.",1,1,1,3,Chechen Rebels,0
2001,29.313775,48.00846,"03/20/2001: Hidaya Sultan Al-Salem, editor-in-chief and owner of Al-Majalis magazine, was shot and killed by unidentified gunmen in her car in Al-Surra, a suburb of Kuwait City, Kuwait. Unknown attackers fired six shots at her using a 9mm Beretta gun. Police later arrested four policemen, a Lieutenant Colonel and three lieutenants in connection with the murder. No group claimed responsibility for the attack.",1,1,1,1,Unknown,1
2001,43.267454,-2.020169,"03/20/2001: Suspected Basque militants shot and killed Socialist councilor and assistant mayor, Froilan Elespe, in Lasarte in northern Spain. Members of Euskadi Ta Askatasuna (ETA) were suspected of perpetrating the assassination, but no group claimed responsiblity for the attack.",1,1,1,1,Basque Fatherland and Freedom (ETA),1
2001,5.545248,95.32401,"03/20/2001: Suspected members of the Free Aceh Movement (GAM) shot at two Army helicopters carrying Indonesian Mines and Energy Minister, Purnomo Yusgiantoro, and his entourage as they were flying over Exxon Mobil's Lhoksukon oil field in Aceh Province, Indonesia. No casualties resulted from the attack and both helicopters were able to land safely. No group claimed responsibility for the attack.",1,1,1,1,Free Aceh Movement (GAM),0
2001,42.846718,-2.671635,"03/21/2001: A pyrotechnic device exploded near the center of Vitoria, Spain, badly damaging a national policeman’s car and starting a fire. The attack did not result in any casualties. No group claimed responsibility for the attack.",1,1,1,3,Unknown,0
2001,42.460823,21.764447,"03/21/2001: Suspected Albanian extremists kidnapped Sergeants Milija Bjelojica and Sasa Bulatovic, two members of the joint security forces, on the road between Bujanovac and Veliki Trnovac, Serbia and Montenegro. No group claimed responsibility for the kidnapping.",1,1,1,6,Albanians,0
2001,42.000273,21.432541,"03/21/2001: Two Macedonian police agents were killed in Skopje, Macedonia. Ethnic Albanians were suspected in the shootings because the armed group had opened fire on the police patrol in a part of Skopje that was a neighborhood with a majority Albanian population. No group claimed responsibility for the shooting.”",1,1,1,2,Other,2
2001,52.336916,-6.463338,"03/21/2001: Two armed and masked gunmen broke into the home of Patrick Moorehouse at 10:00pm in the Ferndale Park neighborhood of Wexford, Leinster province, Ireland, and shot him in both kneecaps in front of his family.  No group claimed responsibility for the incident, although neighbors and authorities speculated that it might have been gang members who mistook Moorehouse for the person they were really looking for.  Moorehouse survived the attack and police were investigating.",1,1,1,2,Unknown,0
2001,54.163768,37.564951,"03/22/2001: Unknown perpetrators stabbed Andrey Brezhnev’s electoral headquarters head, Igor Taradeyev in Russia’s Tula Region. Brezhnev believed the attack was politically motivated, but no group claimed responsibility for the incident.",1,1,1,2,Unknown,0
2001,32.174847,34.803366,"03/22/2001: A bomb exploded near a parked car outside a restaurant in Herzilyya Pituah, Israel, injuring one woman and damaging a number of cars. No group claimed responsibility for the bombing.",1,1,1,3,Unknown,0
2001,2.059263,45.348245,"03/22/2001: A group thought to be supporters of Muhammad Umar Habib killed two men and a woman in an attack on the Ramadan Hotel in Mogadishu, Somalia. Transitional Prime Minister Ali Khalif Galayr and other members of Parliament were staying at the hotel at the time of the attack. No group claimed responsibility for the attack, but the perpetrators were riding in a vehicle belonging to Habib. Habib had withdrawn his support for the transitional government prior to the shooting.",1,1,1,2,Other,3
2001,48.856614,2.352222,"03/22/2001: French police defused a bomb planted in a vehicle in southwest Paris, France, after a spokesman for Armata Corsa, a Corsican resistance group, called Le Monde and Liberation newspapers and tipped them off. The unidentified person stated that the warning was reciprocation for the French government’s capture and arrest of the killers of Corsican guerrilla fighters Jean-Michel Rossi and Jean-Claude Fratacci.",1,1,1,3,Armata Corsa,0
2001,9.30535,-75.3978,"03/22/2001: Unidentified gunmen shot and killed Dr. Jairo Romero Bonilla, a man who used to be the mayor of resort town Tolu, near his office in Sincelejo, Caribbean region, Colombia.  No group claimed responsibility for the incident.",1,1,1,1,Unknown,1
2001,34.010443,74.603442,"03/22/2011: Unidentified gunmen shot and killed Safdar Malik, head of his village and block president of the National Conference, as he was going home from Sonapah village, Kashmir, India.  Although no group claimed responsibility for the attack, sources blamed militants.",1,1,1,1,Militants,1
2001,6.875271,81.830633,"03/23/2001: Suspected members of the Liberation Tigers of Tamil Eelam (LTTE) abducted at least ten farmers who were traveling along a road on a tractor trailer near Potuvil, eastern Sri Lanka. The group stole the tractor as well. No group claimed responsibility for the incident.",1,1,1,6,Liberation Tigers of Tamil Eelam (LTTE),0
2001,24.893379,67.028061,"03/23/2001: An explosion on a bus passing through the Jame cloth market in Karachi, Sindh province, Pakistan, killed one person and wounded nine others.  The police increased security in the area as it was Pakistan Day, a national holiday with celebrations.  No group claimed responsibility for the attack.",1,1,1,3,Unknown,1
2001,42.008513,20.974305,"03/24/2001: Four Macedonian civilians were hospitalized after being injured in an explosion near Tetovo, in the Koltuk region of Macedonia. Ethnic Albanian rebels had been firing mortars into Tetovo from the hills surrounding the town. No group claimed responsibility for the attack.",1,1,1,3,Other,0
2001,43.299442,-1.859099,"03/24/2001: Unknown attackers set fire to a car belonging to a member of Ertzaintza, the autonomous Basque police force, in Oyarzun, Spain. No group claimed responsibility for the attack.",1,1,1,3,Unknown,0
2001,44.216667,43.133333,"03/24/2001: One of three synchronized bombings occurred in the town of Mineralnye Vody in northeast Chechnya, Russia. A car bomb exploded in a farmer's market, overturning parked cars, uprooting kiosks. The blast killed 18 people and injuring 86 others. Although Chechen commanders claimed they were not to blame for the bombing, Russian authorities suspected Chechen militants perpetrated the bombing. This was the first of three related bombings in Chechnya on March 24, 2001.",1,1,1,3,Chechen Rebels,18
2001,44.033333,42.85,"03/24/2001: The second of three synchronized bombings occurred in Yessentuki, Chechnya, four minutes after a bomb exploded in Mineralnya Vody. A car bomb exploded, injuring at least thirteen people. No group claimed responsibility for the bombing, although Russian authorities suspected Chechen militants had perpetrated all three attacks.",1,1,1,3,Chechen Rebels,0
2001,44.35197677,41.94640541,"03/24/2001: The third of three synchronized bombings occurred near Adyge-Khabl in the Karachayevo-Cherkessia republic, Russia. Two inspectors working for the Interior Ministry were killed when a bomb exploded as they were trying to remove it from a car. No group claimed responsibility for the bombing, although Russian authorities suspected that Chechen militants were the perpetrators.",1,1,1,3,Chechen Rebels,2
2001,23.997294,91.9906,"03/24/2001: An attack on a civilian convoy with a paramiltary escort killed five, including two soldiers, and injured three outside of Manu town, Tripura state, India.  Authorities attributed the incident to the National Liberation Front of Tripura (NLFT), although no group claimed responsibility for the attack.",1,1,1,9,National Liberation Front of Tripura (NLFT),5
2001,24.893379,67.028061,"03/24/2001: One person was killed and three injured, including two police officers, when a grenade that was hurled from a car exploded in a camp for Muslim Shiites in Karachi, Sindh province, Pakistan.  No group claimed responsibility for the attack, but authorities blamed sectarians for the incident.  Security in the area was heighted due to the rituals of the Muslim religion that were set to begin.",1,1,1,3,Unknown,1
2001,31.82851,70.907234,"03/24/2001: One worshipper was killed and at least seven were injured when a grenade was thrown into a mosque for Muslim Sunnis in Dara Ismail Khan, Khyber-Pakhtunkhwa province, Pakistan.  No group claimed responsibility for the attack, although local authorities believed it may have been part of the ongoing violence between Sunnis and Shiites.",1,1,1,3,Unknown,1
2001,1.4,-78.566667,"03/24/2001: Thirty villagers were kidnapped by members of the United Self-Defense Forces of Colombia, who were armed with guns and knives, in the early morning in a plaza in Llorente, Narino province, Colombia.  It was unclear if the thirty villagers had been killed.  No group claimed responsibility for the incident.",1,1,1,6,United Self Defense Units of Colombia (AUC),0
2001,32.22626,35.260741,03/25/2001: Suspected Palestinian militants shot and seriously wounded an Israeli motorist from a passing car at an intersection south of the West Bank city of Nablus. No group claimed responsibility for the shooting.,1,1,1,2,Other,0
2001,,,"03/25/2001: Five people, including two women, were shot dead after being kidnapped from residences in an unnamed community of farmers in Colombia, near the Venezuelan border.  No group claimed responsibility for the attack, but the sources blamed the attack on a death squad sent by a paramilitary group.",1,1,1,6,Right-Wing Death Squad,5
2001,,,"03/25/2001: Five members of a family were killed in their home in Ain Agba, Algeria, when armed attackers broke in and cut their throats.  The attackers also left an explosive which detonated when someone found the murdered family, injuring that person.  Although no group claimed responsibility for the attack, sources blamed Muslim fundamentalists.",1,1,1,2,Unknown,5
2001,30.807929,73.450466,"03/25/2001: A boy, fifteen years of age, was injured when a vendor cart exploded in Okara, Pakistan, around 8:30pm.  No group claimed responsibility for the attack.",1,1,1,3,Unknown,0
2001,54.99451,-7.319996,"03/25/2001: No one was injured when youths threw five petrol bombs onto Bishop Street in Fountain estate, Derry, Londonderry county, Northern Ireland around 10:00pm.  There was no mention of property damage done.  Although no group claimed responsibility for the attack, a youth was arrested in possession of a catapult.  This was thought to be a continuation of sectarian violence in the area.",1,1,1,7,Youths,0
2001,32.311957,35.026635,"3/25/2001: David Haim, an Israeli Jew, and three of his Israeli Arab friends were kidnapped masked Tanzim members from the Tarboosh restaurant in Tulkarm, Gaza Strip.  Haim and his three friends were released shortly after their kidnapping on orders from Yasser Arafat, the President of Palestine.",1,1,1,6,Tanzim,0
2001,36.46298,2.81464,"3/25/2001: Suspected members of the Armed Islamic Group (GIA) used an explosive to break into a residence housing three families in Bouarfa, Algeria.  Once inside the home, the assailants killed twelve Algerian civilians using guns and knives.  Algerian security forces later a defused an additional bomb left at the scene that did not detonate.",1,1,1,3,Armed Islamic Group (GIA),12
2001,30.807929,73.450466,"03/25/2001: A bomb exploded near railroad tracks in Okara, Pakistan, around 9:30pm.  No one was injured in the explosion and no group claimed responsibility for the attack.",1,1,1,3,Unknown,0
2001,34.083658,74.797368,"03/26/2001: Three militants entered the 88 Battalion of the Central Reserve Police Force at Gomtibagh in Srinagar, India. The militants killed three Indian soldiers and injured 5 others in an attack in which they threw grenades and fired guns indiscriminately. The militant organization Lashkar-e Taiba claimed responsibility for the attack.",1,1,1,2,Lashkar-e-Taiba (LeT),3
2001,38.405321,27.099755,"03/26/2001: A hand-made time and pipe bomb exploded in front of the trade Registration Office in the Cankaya district of western Izmir province, Turkey, shattering windows of the building. No one has claimed responsibility for the attack.",1,1,1,3,Unknown,0
2001,31.532569,35.099826,"03/26/2001: A father, Yitzhak Pas, and his 10-month-old daughter, Shalhevet, were shot while at a playground outside their home in Hebron, West Bank.  The baby girl was killed after being shot in the head, and the father was flown by helicopter to the hospital with serious injuries to his legs.  Although no group claimed responsibility, sources blamed Palestinian militant snipers for the attack.",1,1,1,2,Palestinians,1
2001,2.146111,31.811111,"03/27/2001: Suspected members of the Lord’s Resistance Army shot and killed nine students from the Jimmy Ssekasi Institute of Catering who were on a field trip at the Murchison Falls National Park. The school’s founder Jimmy Ssekasi and a game ranger were killed in the attack as well. Two students were injured in the attack, while two more were missing. No group claimed responsibility for the attack.",1,1,1,2,Lord's Resistance Army (LRA),11
2001,52.395806,-6.945965,"03/27/2001: Sinn Fein councilor and member of the New Ross Urban District Council, John Dwyer, was seriously injured when he was attacked by two men outside his house in New Ross, County Wexford, Ireland. The two men later were arrested, but no group claimed responsibility.",1,1,1,8,Unknown,0
2001,2.03742,45.337971,03/27/2001: Forces loyal to Muse Sudi Yalahow were suspected to have attacked United Nations employees touring a Medecins Sans Frontieres center in Mogadishu. Yalahow was a local warlord who opposed Somalia’s interim government. The attack did not result in any casualties. No group claimed responsibility for the attack.,1,1,1,2,Other,0
2001,36.742186,3.067875,"03/27/2001: Suspected Algerian rebels shot and killed 15 people living in a shantytown in Hai Benachour, Algeria. No group claimed responsibility for the attack.",1,1,1,2,Unknown,15
2001,4.696879,96.721802,"03/27/2001: Suspected members of the Free Aceh Movement (GAM) injured an 11 year old student and shot and killed a policeman, Inspector Suratman, at the Krueng Cut Bridge in Darussalam, Indonesia. No group claimed responsibility for the incident.",1,1,1,2,Free Aceh Movement (GAM),1
2001,6.706409,121.970784,03/27/2001: Suspected Muslim separatists attacked a barge belonging to the National Power Corporation off the southern Philippine island of Basilan. The attackers approached on a small motorized gunboat and fired automatic rifles and rocket propelled grenades at the barge. No one was injured in the attack. Philippine government authorities suspected that the perpetrators were members of either the Moro Islamic Liberation Front (MILF) or the Abu Sayyef Group (ASG) who both operate in the region.,1,1,1,2,Unknown,0
2001,35.521104,0.310564,"03/27/2001: Unknown attackers shot and slit the throat of a municipal guard, killing him, in El Manaicha, Algeria. After killing the guard, the attackers stole his kalishnikov gun. No group claimed responsibility for the murder.",1,1,1,2,Unknown,1
2001,31.752674,35.221577,"03/27/2001: Three Israeli citizens were injured when a car bomb exploded outside a shopping mall in Talpiot, Israel, around 7:40 a.m.  A passenger bus near the explosion was damaged, as was the surrounding area.  The Islamic Jihad militant organization claimed responsibility for the attack in a phone call.",1,1,1,3,Palestinian Islamic Jihad (PIJ),0
2001,31.819655,35.237816,"03/27/2001: A suicide bomber detonated a bomb near a busy intersection around 1:20pm in Jerusalem, Israel, as a passenger bus pulled up next to him.  The bomber was killed and 28 people were injured in the explosion, which scattered nails packed inside the bomb across the area.  Hamas claimed responsibility for the attack in a statement posted on the Palestinian Information Centre website on 1 April.",1,1,1,0,Hamas (Islamic Resistance Movement),1
2001,0.010089,30.07519,"03/28/2001: Suspected members of the Allied Democratic Forces attacked Hamkungu fishing village in Uganda’s Kasese District. The attack left three people dead while four others were abducted. Also, the perpetrators set fire to one vehicle and four houses. Uganadan General, James Kazini, stated that the attackers were fewer than 10 individuals and that their goal was to loot the village and divert the government forces away from their offensive against their organization. No group claimed responsibility for the attack.",1,1,1,2,Allied Democratic Forces (ADF),3
2001,43.31492777,46.22838402,"03/28/2001: Suspected Chechen rebels detonated three land mines that had been planted on the railway near Gudermes, Chechnya. The three mines exploded as a train carrying out of service equipment passed along the track. Seven cars were derailed and several meters of track were damaged in the attack. No casualties resulted from the explosions. No group claimed responsibility for the incident.",1,1,1,3,Chechen Rebels,0
2001,54.597269,-5.930109,"03/28/2001: Unknown attackers threw a pipe bomb into an unoccupied house in Belfast, Northern Ireland. The bomb exploded and damaged the house. No group claimed responsibility for the bombing.",1,1,1,3,Unknown,0
2001,42.339167,21.569167,"03/28/2001: Suspected militant Albanians attacked a Joint Yugoslav Security Forces checkpoint in Cerevajka, Serbia and Montenegro. The attackers injured one Serbian policeman, Djordje Zarin, in the leg with automatic weapons fire. No group claimed responsibility for the incident.",1,1,1,2,Other,0
2001,32.188798,34.971628,"03/28/2001: The Izz-al-Din al-Qassam Battalions, a militant wing of HAMAS, claimed responsibility for an explosion near an Israeli Army roadblock at a gas station in the Qalqilyah area of the West Bank. The explosion killed three people and injured at least seven others.",1,1,1,3,Hamas (Islamic Resistance Movement),3
2001,32.189444,34.970556,"03/28/2001: A suicide bomber detonated an explosive outside an Israeli gas station in Qalqilya, West Bank.  Three people were killed, including the bomber and two Israeli civilians, and four other civilians were injured.  A subgroup of Hamas, Ezz-Eddin Al-Kassam, later claimed responsibility for the attack.",1,1,1,0,Hamas (Islamic Resistance Movement),3
2001,55.634577,37.743545,"03/28/2001: A father, Dmitry Milovanov, and his daughter were seriously injured when a bomb exploded under their Zhiguli vehicle in Moscow, Russia around 8:30am.  Although no group claimed responsibility for the attack, authorities suggested it may be related to organized crime.",0,1,1,3,Unknown,0
2001,36.624951,2.405567,"03/29/2001: Six unknown attackers massacred five members of the Hechchad family in Oued Rezzoug, near the forest of El Ghorari in Tipaza, Algeria. Two other members of the family were wounded in the assault as well. The attackers stole food and jewelry from the family's house. No group claimed responsibility for the attack.",1,1,1,2,Unknown,5
2001,24.909554,93.875824,"03/29/2001: Two Indian soldiers died and two others were seriously wounded when a bomb exploded in Ichum Lairembi, India. After the bomb exploded, militants began firing guns at the remaining troops of the 15th Jat regiment from positions in the Pheidinga Hills. Indian troops, returning fire, killed one militant. No group claimed responsibility for the attack.",1,1,1,3,Unknown,3
2001,43.136978,-2.073914,"03/29/2001: Members of the Euskadi Ta Askatasuna (ETA) bombed two court buildings in Tolosa, Spain. No one was injured in the attacks and the damage to the two buildings was not severe. An unknown person called after the bombings indicating that ETA was responsible for the attacks.",1,1,1,3,Basque Fatherland and Freedom (ETA),0
2001,3.265931,97.177063,"03/29/2001: Three people were found shot dead on a road outside of Tapaktuan, Aceh province, Indonesia.  The three men killed included a religious leader working for human rights and a lawyer involved in a legal case the religious leader was involved in, in which he had accused local police of raping teenage women in the area.  Although no group claimed responsibility for the attack, the Human Rights Watch group blamed local police as the three men were returning home from the police station at the time of the attack.",1,1,1,2,Unknown,3
