iyear,latitude,longitude,summary,crit1,crit2,crit3,attacktype1,gname,nkill2001,38.880777,-77.108273,"09/11/2001: This was one of four related terrorist attacks that occurred in the U.S.A. and that are known collectively as the 9/11 Terrorist Attacks. In the third of these attacks, which occurred at 9:37 am local time, American Airlines Flight 77 crashed into the Pentagon in Arlington, Virginia.  Five hijackers belonging to the terrorist organization, Al-Qa`ida, hijacked the Boeing 757 aircraft on a flight from originating from Washington Dulles International Airport destined for Los Angeles International Airport and proceeded to fly the plane into the western side of the Pentagon.  On the plane were 53 passengers, 6 crew members and 5 hijackers, all of whom died upon impact. 125 people died in the Pentagon due to the impact or in the resulting fire. Although not immediately known at the time of the attack, the Al-Qa`ida terrorist network, lead by Osama bin Laden, was responsible for all four of these attacks. Al-Qa`ida leaders such as bin Laden and Khalid Shaikh Mohammed claimed responsibility for the attacks in multiple videotaped interviews over the next few years.",1,1,1,4,Al-Qaida,189
2001,40.018464,-78.907197,"09/11/2001: This was one of four related terrorist attacks that occurred in the U.S.A. and that are known collectively as the 9/11 Terrorist Attacks. In the fourth of these attacks, occurring at 10:03 am local time, United Airlines Flight 93, a Boeing 757 passenger airplane, crashed en route from Newark, New Jersey to San Francisco, California. The airliner crashed in a rural area of Pennsylvania near the town of Shanksville following a struggle for control of the plane between the passengers and four hijackers. 29 passengers, seven crew members, and four hijackers died in the crash. Al-Qa`ida leader, Khalid Shaikh Mohammed, indicated in a 2002 interview with the Doha based Al Jazeera News Network that the intended target of Flight 93 had been the U.S.A. Capitol Building located in Washington D.C. The Al-Qa`ida hijackers had planned on flying the airplane into the Capitol Building just as the other planes in the coordinated strike had been flown into the two World Trade Center towers in New York City and the Pentagon in Arlington, Virginia. Although not immediately known at the time of the attack, the Al-Qa`ida terrorist network, lead by Osama bin Laden, was responsible for all four of these attacks. Al-Qa`ida leaders such as bin Laden and Khalid Shaikh Mohammed claimed responsibility for the attacks in multiple videotaped interviews over the next few years.",1,1,1,4,Al-Qaida,44
2001,40.183333,44.516667,"09/11/2001: Andranik Markarian, the Prime Minister's aide and a businessman, was killed by a grenade left at his front door around 9:15am in Yerevan, Armenia.  Although no group claimed responsibility for the attack, sources thought it might be related to his business dealings.",1,1,1,1,Unknown,1
2001,48.936616,2.324789,09/12/2001: A home-made explosive device lacking a detnator was discovered in front of a synagogue in the Villeneuve-la-Garenne neighborhood of Paris. The device was discovered after an anonymous call was made to the police. Police successfully disposed of the bomb and there were no casualties. No group claimed responsibility.,1,1,1,3,Unknown,0
2001,31.532569,35.099826,"12/09/2001: One Israeli man was wounded and vehicles were damaged when Palestinian gunmen fired at a funeral procession in Hebron, West Bank.  No group claimed responsibility for the attack, but sources believed this was a continuation of the violence between Israelis and Palestinians over the disputed territory.",1,1,1,2,Palestinians,0
2001,32.793921,34.990615,"12/09/2001: Twenty-eight people were wounded when a suicide bomber detonated a bomb strapped to his chest at a bus stop in Haifa, Northern district, Israel.  The bomb did not detonate correctly, and when the bomber attempted to detonate a second bomb in a bag he carried, he was shot and killed by police and soldiers in the vicinity.  No one was seriously wounded or killed due to the bomb's malfunction.  The bomber, Nimr Abu Sayfien, left a suicide note at his home in Yamoun claiming the attack was a response to the killing of Mahmoud Abu Hanoud, a Hamas leader, by Israel.  No group claimed responsibility for the bombing.",1,1,1,0,Unaffiliated Individual(s),1
2001,7.48722,124.29917,"09/13/2001: Alleged Moro Islamic Liberation Front (MILF) rebels killed three soldiers and injured six others with automatic rifles. The attackers attacked when Philippine soldiers were in their vehicles on their way back to camp in Barira, Maguindanao Province, Philippines.",1,1,1,2,Moro Islamic Liberation Front (MILF),3
2001,38.11564,13.361406,"09/13/2001: An arson attack with bottles of flammable liquid on two police cars in Palermo, Sicily in Italy resulted in injuries to responding policemen due to smoke inhalation. No group claimed responsibility for the attack.",1,1,1,2,Unknown,0
2001,43.316667,45.683333,"09/13/2001: A convoy carrying humanitarian cargo sent by Krasnodar nongovernmental organizations and accompanied by an OMON special police vehicle en-route to Lermontov-Yurt was hit by an unknown explosive device. Five people, including four civilians and one police officer, were wounded in the attack. While group claimed responsibility for the attack, Chechen Rebels (non-specific) were suspected.",1,1,1,3,Unknown,0
2001,35.60986,-0.56448,"09/13/2001: Members of Habi’s Er’roub were suspected in an attack where seven men had their throats slit in Granine, Algeria at a bogus roadblock on Wilaya Road No. Five. The victims were traveling in a taxi and two motorcycles. No group claimed responsibility for the attacks.",1,1,1,2,Habi's Er'roub seriat,7
2001,10.47692,-73.25049,"09/14/2001: A car bomb planted by suspected leftist rebels caused heavy property damage but no casualties in Valledupar, Colombia. The explosion caused damage to residences and a commercial warehouse over a three-block area. The Renault sedan used in the attack was packed with 100 pounds of explosives. While, no group claimed responsibility for the attack, Fuerzas Armadas Revolucionarias de Colombia (FARC) were suspected.",1,1,1,3,Revolutionary Armed Forces of Colombia (FARC),0
2001,8.41759,-73.796322,"09/14/2001: Fuerzas Armadas Revolucionarias de Colombia (FARC)guerrillas, Fronts 35 and 27, were suspected to have blown up the gas pipeline that served the Montes de Maria region in the center of Bolivar Department, Colombia. The blast left 16,000 users in Bolivar Department without natural gas for seventy-two hours. No group claimed responsibility for the attack.",1,1,1,3,Revolutionary Armed Forces of Colombia (FARC),0
2001,32.925224,75.135264,"09/15/2001: An Indian border guard was killed and four other guards were injured in a landmine blast planted by militants near Udhampur in India's Jammu and Kashmir State. The soldiers struck a landmine while traveling in their jeep 142 miles south of Srinagar, Kashmir. No group claimed responsibility for the attack.",1,1,1,3,Unknown,1
2001,-18.197385,18.793923,"09/15/2001: National Union for the Total Independence of Angola (UNITA) members were suspected of kidnapping an unknown number of Kavango villagers in the Lighuyu area of Namibia, one hundred thirty-five kilometers east of Rundu. UNITA did not claim responsibility for the kidnappings.",1,1,1,6,National Union for the Total Independence of Angola (UNITA),0
2001,34.083658,74.797368,"09/15/2001: Five Indian security personnel were injured when suspected separatist Islamic militants attacked two security vehicles with hand grenades in Srinagar, Kashmir. No group claimed responsibility for the attacks.",1,1,1,3,Unknown,0
2001,36.077619,2.096665,"9/15/2001: Suspected members of the Armed Islamic Group (GIA) shot and killed four Algerian civilians in Sidi Boumaza, Algeria.  It is unknown if the gunshots caused any property damage.",1,1,1,2,Armed Islamic Group (GIA),4
2001,42.024722,21.079722,"09/16/2001: Ethnic Albanian rebels shot at police checkpoints in Semsovo, Macedonia with police returning fire. There were no casualties and no groups claimed responsibility for the attack.",1,1,1,2,National Liberation Army (NLA) (Macedonia),0
2001,5.12379,-74.95201,"09/16/2001: 11 Colombian workers were killed and two injured in a rural area in the Falan Municipality, Colombia. The civilians were killed during a raid by alleged members of the United Self-defense Forces of Colombia (AUC - Las Autodefensas Unidas de Colombia) . No group claimed responsibility for the attack.",1,1,1,2,United Self Defense Units of Colombia (AUC),11
2001,23.811388,90.412106,"09/16/2001: Ten people were injured when gunmen, allegedly belonging to the former parliament, Awami League member, Joynal Hazari, opened fire on the motorcade escorting a procession led by the Bangladesh Nationalist Party Chairperson Khaleda Zia. No group claimed responsibility for the attack.",1,1,1,2,Other,0
2001,36.729153,5.866485,"09/16/2001: Members of Hassan Hattab's Salafist Group for Preaching and Fighting (GSPC) used automatic weapons to kill a communal guard in Azzaouen, Emir Ebdelkader Commune, Algeria. The shooting cam after the attackers exploded a device that killed a child. Communal guards killed two of the perpetrators and wounded an undetermined amount of others. No group claimed responsibility for the attack.",1,1,1,2,Salafist Group for Preaching and Fighting (GSPC),2
2001,35.52832,-0.19369,"09/16/2001: An armed group wearing military uniforms attacked Miloud Hadrouga’s home at the Logements housing complex in Sig, Algeria. Eight members of Hadrouga's family were killed in the attack. As the attackers retreated, they killed a 16 year old boy as well. No group claimed responsibility for the attack.",1,1,1,2,Unknown,9
2001,,,"09/16/2001: Suspected members of the Fuerzas Armadas Revolucionarias de Colombia (FARC)’s (FARC) 41st Front sabotaged a major gas pipeline in the northeastern region of Colombia, causing about $2.9 million in damage. No group claimed responsibility for the attack.",1,1,1,7,Revolutionary Armed Forces of Colombia (FARC),0
2001,8.5922,81.196796,"09/16/2001: The Liberation Tigers of Tamil Eelam (LTTE) attacked a military-chartered ferry, MV Pride of South, carrying 1,200 government soldiers off the coast of Trincomalee, Sri Lanka. 31 died in the attack, including 10 of the attackers. At least sixty-five sailors and soldiers were injured in the fighting. The LTTE swarmed the ferry with 20 boats during the attack and attempted to ram the ship with explosive-packed ships, but failed to get close enough to detonate their bombs.",1,1,1,0,Liberation Tigers of Tamil Eelam (LTTE),31
2001,23.700122,120.200283,"09/16/2001: No casualties resulted when gunmen fired over twenty shots at the house of the former township head of Taihsi, Wu Cheng-ching, in Taiwan’s Yunlin County. Local police suspected that the attack was related to the upcoming year-end legislative and local government heads elections. No group claimed responsibility for the attack.",1,1,1,2,Unknown,0
2001,43.296944,45.77,"09/17/2001: Nine Russian soldiers, including a general, died when suspected Chechen Rebels (non-specific) shot down their Mi-8 helicopter in Khankala, Chechnya. No group claimed responsibility for the attack.",1,1,1,2,Chechen Rebels,9
2001,43.3,45.866667,"09/17/2001: A police officer was killed and several buildings damaged when the house of Movsar Timerbayev, administration head of the town of Argun in Chechnya, was blown up by a suicide bomber. The bomber was driving a truck filled with explosives. The suicide bomber died in the explosion and no group claimed responsibility for the attack.",1,1,1,0,Unknown,1
2001,34.399616,74.281748,"09/17/2001: Eleven policemen were killed and nine injured when suspected Islamic militants of the Islamic separatist group Lashkar-e Taiba attacked their police camp in Handawar in the northern region of India-Kashmir. The attackers hurled grenades and fired weapons at the Indian police camp. One militant, identified as Abu Osama, was shot dead by police. No group claimed responsibility for the attack.",1,1,1,2,Lashkar-e-Taiba (LeT),12
2001,43.3,45.866667,"09/18/2001: One policeman was killed and three wounded after suspected Chechen rebels opened fire on the police headquarters in Argun, Chechnya. No group claimed responsibility for the attack.",1,1,1,2,Chechen Rebels,1
2001,32.493537,74.530343,09/19/2001: Two people were killed and at least 40 injured when a bomb went off in a crowded market area in Sialkot near Pakistan's border with India. No group claimed responsibility for the attack.,1,1,1,3,Unknown,2
2001,-12.385772,16.935639,"09/19/2001: Five people were killed and six injured in an ambush on their truck near Belchior, on the road between Cuito and Camacupa in the Bie Province of Angola. No group claimed responsibility for the attack.",1,1,1,2,Unknown,5
2001,43.2039,46.1317,"09/19/2001: The police chief of Kurchaloyevskiy District, Salman Abuyev, and six policemen were killed when gunmen attacked them between the villages of Mayrtup and Kurchaloy, Chechnya, Russia. Several of the attackers are reported to have died in the ensuing gun battle as well. No group claimed responsibility, but Chechen separatist rebels were suspected to be behind attack.",1,1,1,2,Chechen Rebels,7
2001,1.807411,-78.763753,"09/19/2001: A right-wing military group was accused of killing a Roman Catholic nun and human rights advocate, Yolanda Ceron, in Tumaco.",1,1,1,1,Right-Wing Paramilitaries,1
2001,53.578474,-2.429915,"09/19/2001: A suspected firebomb attack occurred on a mosque, in Bolton, England, shattering four windows but injuring none. No group claimed responsibility for the attack.",1,1,1,3,Unknown,0
2001,27.718332,85.325337,"09/19/2001: Six or seven suspected Maoist rebels burned a state-owned Radio Nepal vehicle using gasoline on the outskirts of Kathmandu, Nepal, after stopping it and pulling its passengers from the vehicle. No group claimed responsibility for the attack.",1,1,1,7,Maoists,0
2001,7.894195,-72.503885,"09/19/2001: Unidentified gunmen shot and killed Jesus David Corzo, an official with the Attorney General's Technical Investigations Force, and wounded his mother as they walked in a neighborhood in Cucuta, Norte de Santander province, Colombia.  No group claimed responsibility for the attack, and the gunmen abandoned the truck they were driving shortly after the shooting.  Nine years later, a National Human Rights and International Humanitarian Law prosecutor indicted Jorge Ivan Laverde, also known as the Iguana, for the murder.",1,1,1,1,Unknown,1
2001,31.816667,35.230976,"09/20/2001: A firebomb was hurled at a Border Police patrol car in the Shu’fat refugee camp north of Jerusalem, Israel injuring none. Security forces arrested two members of the Popular Front for the Liberation of Palestine (PLFP) who upon being interrogated admitted to staging the attack.",1,1,1,3,Popular Front for the Liberation of Palestine (PFLP),0
2001,31.645331,35.244064,"09/20/2001: The Al-Aqsa Martyrs Brigades, a group linked to Palestinian leader Yasser Arafat's Fatah movement, claimed responsibility for killing Sarit Amrani and wounding her husband. The drive-by shooting occurred a few miles from the Nokdim settlement between two military checkpoints in Israel. Palestinian authorities detained two suspects for questioning in the shooting attack.",1,1,1,2,Al-Aqsa Martyrs Brigade,1
2001,5.183798,97.141575,"09/20/2001: A Sergeant Major in the Indonesian Army and his wife were found dead with gunshot wounds to the head at Blang Payang near the town of Lhokseumawe, Indonesia. Police suspected the Free Aceh Movement in this incident but no group claimed responsibility.",1,1,1,2,Free Aceh Movement (GAM),2
2001,-12.385772,16.935639,"09/20/2001: Five people were killed and six injured when their truck was ambushed in Angola's Bie Province near the village of Belchoir. The attack was blamed on National Union for the Total Independence of Angola (UNITA), although no group claimed responsibility.",1,1,1,2,National Union for the Total Independence of Angola (UNITA),5
2001,32.89925,-105.960323,"09/20/2001: An incendiary device exploded at a maintenance building at the White Sands Research Center in New Mexico, U.S.A., a research laboratory that uses chimpanzees in medical studies. The Animal Liberation Front (ALF) claimed responsibility for this explosion that caused more than $1 million in damages.",1,1,1,3,Animal Liberation Front (ALF),0
2001,31.652877,35.227656,"09/20/2001: An Israeli woman was killed and her husband was seriously wounded when Palestinian gunmen in a truck fired upon their car as they drove near Tekoa, West Bank.  The couple's three children survived unharmed in the backseat of the car.  No group claimed responsibility for the attack, which sources speculated was going to disrupt peace talks between Israelis and Palestinians.",1,1,1,2,Palestinians,1
2001,-3.923349,29.990378,"09/22/2001: Two people were killed and two were injured by rebels with guns during an attack in Munyegeri, Burundi. The attack occurred when the victims were attending a dowry payment ceremony. No group claimed responsibility for the attack.",1,1,1,2,Unknown,2
2001,54.597269,-5.930109,"09/23/2001: A Loyalist gunman shot and injured a Nationalist woman at Clifton Park Avenue, Belfast, Northern Ireland after crowds began hurling bricks and stones at each other. Police quickly gained control of the melee. No group claimed responsibility for the shooting.",1,1,1,2,Unknown,0
2001,6.270526,-75.572173,"09/23/2001: A Slovak missionary, Pavol Sucholak, and two others were kidnapped by leftist rebels in the northeast of Colombia while traveling on a bus from Medellin to Bogota. No group claimed responsibility for the kidnapping. The outcome of the kidnapping has remained unknown.",1,1,1,6,Unknown,0
2001,43.25,46.583333,"09/23/2001: A schoolboy and woman were killed and eight others were injured in a car bomb explosion in the city of Khasavyurt, Dagestan. The bomb was placed in a parked car outside of an office building that houses telephones used by Russian servicemen making long distance calls home. Police suspected the perpetrators were targeting federal servicemen but no group claimed responsibility.",1,1,1,3,Unknown,2
2001,23.907766,85.513586,09/23/2001: At least 12 security personnel were killed and six others injured when their vehicles struck two landmines suspected of belonging to the Maoist Communist Center. The Indian Security Forces were in the Abroja Forest on a combing mission when their vehicles hit the mines. No group claimed responsibility for the land mines.,1,1,1,3,Maoist Communist Center (MCC),12
2001,-27.470933,153.023502,"09/23/2001: A Brisbane, Australia mosque was ruined in a suspected arson attack. No group claimed responsibility.",1,1,1,7,Unknown,0
2001,-6.208821,106.846046,"09/23/2001: Two bombs planted in a car exploded in a parking garage of the Atrium Plaza shopping mall in central Jakarta, Indonesia. No one was harmed in the attack. Although some local authorities suspected that the Free Aceh Movement (GAM) was behind the attack, no group claimed responsibility.",1,1,1,3,Free Aceh Movement (GAM),0
2001,42.846718,-2.671635,"09/24/2001: A home-made bomb exploded in front of the ANUA driving school in Vitoria, Spain. The driving school was owned and operated by Jose Luis Anua who was also the leader of Alavese Unity, small conservative party in the Basque Region of Spain. No one was injured in the attack. No group claimed responsibility for the bombing.",1,1,1,3,Unknown,0
2001,32.484198,35.343315,09/24/2001: A suspected Palestinian gunman killed an Israeli woman in a drive-by shooting in the Jordan Valley of the West Bank. No one was apprehended in the killing and no group claimed responsibility for the attack.,1,1,1,2,Unknown,1
2001,9.66123,80.02558,09/24/2001: Six people were killed by an explosion believed to be caused by a trigger or pressure mine as their taxi was heading towards a military airfield in the northern Jaffna Peninsula in Sri Lanka. Members of the Liberation Tigers of Tamil Eelam (LTTE) were thought to be responsible for the attack. No group claimed responsibility.,1,1,1,3,Liberation Tigers of Tamil Eelam (LTTE),6
2001,32.386375,35.480835,"09/24/2001: One Israeli woman was killed when Palestinian gunmen opened fire on the vehicle she was traveling in with her husband in Jordan Valley, West Bank.  No group claimed responsibility for the attack.",1,1,1,2,Palestinians,1
2001,10.47692,-73.25049,"9/24/2001: Colombian Inspector General Consuelo Araujo Noguera was found shot dead after she and a dozen others were kidnapped  at a roadblock by members of the Revolutionary Armed Forces of Colombia (FARC) near Valledupar, Cesar province, Colombia.  The other individuals kidnapped were released.  Although FARC did not claim responsibility for the incident, authorities believed this was a response to ongoing peace talks between the rebel group and the Colombian government.",1,1,1,6,Revolutionary Armed Forces of Colombia (FARC),1
2001,-9.035466,13.266699,"09/25/2001: The National Union for the Total Independence of Angola (UNITA), led by Jonas Savimbi, attacked an ENE electric substation building near Viana, in the Luanda Province of Angola. The perpetrators destroyed three generators resulting in a loss of power to Viana, Luanda Sul, Catete, Bom Jesus and the Luanda central water supply center in Quicuchi. As a result of the power losses, neither Luanda nor the Quicuchi Area had water following the attack. Two security personnel and an electric company worker died in the assault. No group claimed responsibility for the attack.",1,1,1,7,National Union for the Total Independence of Angola (UNITA),3
2001,26.515135,90.679677,"09/25/2001: At least 100 passengers on a train were inured when suspected members of the National Democratic Front of Bodoland (NDFB) remotely detonated a bomb placed under a bridge that the train was crossing over in Baghmara, Bongaingaon district, India around 7:00pm.  The bomb derailed seven of the train's cars, but no one was killed.  No group claimed responsibility for the attack.",1,1,1,3,National Democratic Front of Bodoland (NDFB),0
2001,-17.624167,177.452778,09/26/2001: A mosque was set on fire in the city of Lautoka's Drasa-Vitogo area in Fiji. No one was injured in the arson attack. No group claimed responsibility.,1,1,1,7,Unknown,0
2001,34.533056,69.166111,"09/26/2001: A mob of thousands set fire to the abandoned United States Embassy in Kabul, Afghanistan. Although most of the perpetrators were pro-Taliban government workers and students, no group claimed responsibility for the attack.",1,1,1,7,Taliban,0
2001,7.080833,126.202946,09/26/2001: Five suspected communist guerrillas of the New People’s Army (NPA) raided a village dance in Lupon on Mindanao Island in the southern Philippines. The perpetrators killed a policeman and a government militiaman. No group claimed responsibility for the attack.,1,1,1,2,New People's Army (NPA),2
2001,24.586944,91.265,"09/26/2001: Four people were killed and two were injured by a bomb that went off on the first floor of the Upazila Health Complex in Sulla Upazila Sadar, Sunamganj District, Bangladesh before the start of an election projection meeting of the Awami League. No group claimed responsibility for the attack.",1,1,1,3,Unknown,4
2001,36.56522,3.153934,"09/27/2001: Four suspected Islamic militants shot and killed 22 people and injured seven others as they celebrated a wedding in Larbaa, Algeria. No group claimed responsibility for the attack.",1,1,1,2,Unknown,22
2001,2.64934,-75.636802,"09/27/2001: Fuerzas Armadas Revolucionarias de Colombia (FARC)members were suspected of kidnapping a Russian technician in Huila Province at an electrical power station near the town of Iquira. They also kidnapped four other Colombian workers whom they subsequently released. The victims were employees of Sgem World of Colombia, which carries out maintenance work at electricity facilities in Huila Province. FARC did not claim responsibility for the kidnappings.",1,1,1,6,Revolutionary Armed Forces of Colombia (FARC),0
2001,47.174589,8.513854,"09/27/2001: Fourteen people were killed and another 18 were injured when a Swiss man disguised as a policeman opened fire with an assault rifle during a session of the Canton of Zug’s local assembly in Zug, Switzerland. A bomb may have been detonated near the assembly building as well. The man also died and no group claimed to be connected to the incident.",1,1,1,2,Unknown,14
2001,-33.469115,-70.641997,"09/27/2001: A letter bomb addressed to the US ambassador in Chile was sent through a private courier service to the US Embassy in Santiago.  Police responded to the scene after infrared scanners at the US Embassy detected an explosive device inside the letter. Chilean police successfully defused the device before the bomb exploded. Chilean Interior Minister, Jose Miguel Insulza, said that there was advance warning of the attack, but did not mention specific groups that may have been responsible. No group claimed responsibility for the letter bomb.",1,1,1,3,Unknown,0
2001,31.285159,34.249789,"09/28/2001: Three Palestinians, Shadi Lafi, Ahmad Mahdi, and Lu’ay Abu-Akar, from the town of Rafah in the Gaza Strip, were killed when a bomb detonated in the vicinity of Al-Nur mosque. Palestinian media reports on the incident indicated that the explosion was thought to be caused by a charge planted by the Israeli occupation army at an earlier point in time. No group claimed responsibility for the attack.",1,1,1,3,Unknown,3
