iyear,latitude,longitude,summary,crit1,crit2,crit3,attacktype1,gname,nkill2002,31.775961,35.218076,03/28/2002: A female suicide bomber detonated an explosive device at the entrance of a Jerusalem supermarket (SuperSol) that killed two people and wounded twenty more. The Al-Aqsa Martyrs Brigade claimed responsibility for the attack and identified the assailant as eighteen year old Aayat al-Akhras from Bethlehem.,1,1,1,0,Al-Aqsa Martyrs Brigade,3
2002,36.480453,2.83388,"03/29/2002: Two civilians were killed and eighteen were wounded when two homemade explosive devices exploded in a food market in an eastern suburb of Blida, Algeria, approximately thirty miles from Algiers. No one claimed responsibility for the attack; however local authorities blamed the bombing on militants of the Armed Islamic Group (GIA).",1,1,1,3,Armed Islamic Group (GIA),2
2002,27.718332,85.325337,"03/29/2002: An explosive device detonated on a bridge over the river Bishnumati in Katmandu, Nepal, which wounded twenty people. No one claimed responsibility for the attack, but Nepalese authorities suspected the involvement of rebels belonging to the Nepal Communist Party (Maoist).",1,1,1,3,Maoists,0
2002,31.483495,34.450067,"03/29/2002: A Palestinian attacker stabbed two death two elderly civilians in the Jewish settlement of Netzarim in the Gaza Strip. According to Israeli officials, Michael Orlanski, 70, from Tel Aviv and Tuvia Wizner, 79, from the nearby town of Petah Tikva in northern Israel, were leaving a synagogue when the assailant struck. In a published statement, the Palestinian Islamic Jihad (PIJ) claimed responsibility for the attack and identified the assailant as twenty two year old Mohamad Ahmad Khazzik from the al-Sabra neighborhood in Gaza City.",1,1,1,2,Palestinian Islamic Jihad (PIJ),3
2002,5.31723,-75.78713,"3/28/2002: Suspected members of Revolutionary Armed Forces of Colombia (FARC) set up an illegal road block near San Clemente, Risaralda Department, Colombia.  The rebels took eight people hostage, releasing four, and lit two tractor trailers on fire.  Specific motive is unknown.",1,1,1,6,Revolutionary Armed Forces of Colombia (FARC),0
2002,32.726602,74.857026,"03/30/2002: Two Islamic militants attacked the 150-year-old Hindu Raghunath Temple in Indian-controlled Jammu. The assailants detonated several grenades directly outside the temple as well as shot passersby and worshippers with AK-47 rifles. Four policemen, four civilians and the two attackers were killed. Twenty more people, predominantly civilians, were wounded. The Islamic Front, a Kashmiri rebel group based in Pakistan, claimed responsibility for the attack. In a phone call to the Associated Press after the incident, Bilal Beg, who claimed to have been the group’s leader, stated that the attack was in retaliation to the violence against Muslims in India.",1,1,1,3,Islamic Front,10
2002,32.070901,34.770039,"03/30/2002: A Palestinian suicide bomber detonated an explosive device inside a Tel Aviv café that wounded thirty-two civilians. The blast destroyed the café (My Coffee Shop) and caused heavy damage to the adjacent businesses. The Al-Aqsa Martyrs Brigade claimed responsibility for the attack and identified the bomber as 23-year-old Ibrahim Salahat from the northern West Bank town of Nablus. A spokesman for the terrorist organization claimed that the attack was a response to Israel’s military barricade of Yasser Arafat’s compound in Ramallah, West Bank.",1,1,1,0,Al-Aqsa Martyrs Brigade,1
2002,50.4501,30.5234,"3/29/2002: Mykola Shkriblyak, a candidate of the Social Democratic Party, was shot inside of his apartment building in Kiev, Kiev City Municipality, Ukraine.  He died the next day from his injuries.  No group has claimed responsibility for the attack and the motive is unknown; however, the attack occurred two days before parliamentary elections.",1,1,1,1,Gunmen,1
2002,6.18908,-67.4826,"3/30/2002: A bomb exploded in front of a discotheque in Puerto Carreno, Vichada Department, Colombia.  At least two soldiers were killed in the explosion and 14 civilians were injured.  Authorities suspect that members of Revolutionary Armed Forces of Colombia (FARC) were responsible for the incident.",1,1,1,3,Revolutionary Armed Forces of Colombia (FARC),2
2002,32.793921,34.990615,"03/31/2002: A suicide bomber detonated an explosive device inside the “Matza Restaurant” in Haifa, Israel, which killed fourteen people and wounded thirty-five others, including five Arab Israeli citizens. The bomb blast blew the roof off of the one-story restaurant that fell upon the customers inside. HAMAS claimed direct responsibility for the attack and identified the assailant as twenty-three year old Shadi Abu Tubasi from the West Bank city of Jenin. A HAMAS spokesman claimed the attack was a response to Israel’s military barricade of Yasser Arafat’s compound in Ramallah, West Bank.",1,1,1,0,Hamas (Islamic Resistance Movement),15
2002,31.653707,35.149941,"03/31/2002: A suicide bomber detonated an explosive device in the Jewish, West Bank settlement of Efrat that wounded four people, including one paramedic. Israeli officials stated that the assailant approached a group of volunteer medics and subsequently blew himself up. The Al-Aqsa Martyrs Brigade claimed responsibility for the attack, and identified the bomber as seventeen year old Jamil Khalaf Hamid from the West Bank town of Bethlehem.",1,1,1,0,Al-Aqsa Martyrs Brigade,1
2002,50.836536,4.308195,"04/01/2002: Five Molotov cockatil firebombs were launched at a Belgian synagogue located in the Anderlecht suburb of Brussels. Two firebombs hit the building, breaking through windows, and caused a fire. Local fire patrols contained the fire withing 45 minutes, and no one was injured. The attack was blamed on rising tensions over the Israeli-Palestinian battles. There were no suspects.",1,1,1,7,Unknown,0
2002,-15.225173,22.183554,"04/01/2002: Suspected members of the Angolan rebel group National Union for the Total Independence of Angola (UNITA) abducted three Zambians from the town of Sikongo in Zambia. Approximately 15 rebels attacked the villagers, and raped one of the abducted women before kidnapping them. They are believed to have been held in Angola. They have not been released, and the reasons for the abduction are unknown.",1,1,1,6,National Union for the Total Independence of Angola (UNITA),0
2002,31.768276,35.215924,"04/01/2002: A suspected member of the Al-Aqsa Martyrs Brigade approached a police vehicle checkpoint in Jerusalem. When approached by a police officer, he detonated a bomb in his car, killing himself and the police officer. No others were reported killed.",1,1,1,0,Al-Aqsa Martyrs Brigade,2
2002,32.311945,35.026548,04/01/2002: Palestinian gunmen attacked the Tulkarem police station and killed 8 Palestinian prisoners that were suspected to have been collaborating with the Israeli Defense Forces (IDF). Simultaneous attacks on other suspected collaborators occured in Qalqilya and Bethlehem. The identities of the attackers were not known and no one was captured.,1,1,1,2,Unknown,8
2002,32.188774,34.971682,04/01/2002: Palestinian gunmen attacked and killed 2 Palestinians suspected of collaboarting with the Israeli Defense Forces in Qalqilya. The identities of the attackers were not known and no one was captured. Simultaneous killings occurred in Tulkarem and Bethlehem.,1,1,1,2,Unknown,2
2002,31.705761,35.202687,"04/01/2002: Palestinian gunmen attacked and killed 1 person in the city of Bethlehem. The man was accused of collaborating with Israeli Defense Forces. The identities of the attackers were not known, and no one was captured.",1,1,1,2,Unknown,1
2002,-3.36364,29.390916,"04/01/2002: A mortar exploded in the home of a doctor known as Fabien. Fabien lived near the Lumiere University on Buyogoma Avenue. No one was killed, but three were injured, including a houseboy and Fabien's two sons. No suspects were found. A simultaneous explosion occured at the Mutanga South Municipal College.",1,1,1,3,Unknown,0
2002,-3.36364,29.390916,"04/01/2002: A mortar exploded at the Mutanga South Municipal College. One student was slightly injured, and no one was killed. No suspects have been found. A simultaneous mortar landed in the home of a Doctor Fabien near the Lumiere University. Two other explosions were heard, but could not be verified.",1,1,1,3,Unknown,0
2002,,,"04/01/2002: The Baramulla National Conference leader, Ghulam Mohiuddin Dar, was killed by militants at his home in Kachumuqam. Militants entered his home and fired their weapons at close range, killing Dar instantly. No others were killed. No suspects have been found.",1,1,1,1,Unknown,1
2002,43.166667,131.933333,"1/4/2002: A bomb exploded in the Rein petroleum products company in Vladivostok, Primorsky Krai, Russia.  The bomb was hidden in a lamp that had been delivered as a New Years gift to the company by two women dressed as Grandfather Frost and the Snow Maiden, two popular holiday figures.  Three employees were injured in the explosion and a company office was destroyed.  No group claimed responsibility for the incident.",1,1,1,3,Unknown,0
2002,30.929589,66.468052,"4/1/2002: Two unidentified assailants threw a grenade at Muslims as they left a mosque in Chaman, Balochistan province, Pakistan.  At least two people were killed in the explosion and another 35 were wounded.  The assailants fled and no group claimed responsibility for the incident.",1,1,1,3,Unknown,2
2002,32.742599,69.521949,"4/1/2002: A bomb exploded on a passenger bus in Spenki Raghzai, Waziristan region, Pakistan.  Two people were killed and another 12 were injured in the explosion.  No group has claimed responsibility for the incident.",1,1,1,3,Unknown,2
2002,34.649167,0.015833,"4/1/2002: Suspected members of the Salafist Group for Preaching and Fighting (GSPC) ambushed Algerian security forces on a search operation in Moulay Larbi, Algeria.  Twenty soldiers and one member of the Algerian militia were killed.  It is unknown if the gunshots caused any property damage.",1,1,0,2,Salafist Group for Preaching and Fighting (GSPC),21
2002,-12.766306,15.732598,"4/1/2002: Suspected members of National Union for the Total Independence of Angola (UNITA) attacked a group of people traveling in a truck in Huambo province, Angola.  The assailants killed seven of the passengers in the vehicle and wounded another four passengers.  The incident occurred just days before a formal ceasefire was signed by the government and UNITA.",1,1,1,9,National Union for the Total Independence of Angola (UNITA),7
2002,-4.274011,14.356515,"04/02/2002: Unidentified gunmen attacked a train traveling from Pointe Noire to Brazzaville in the Democratic Republic of Congo. Three civillians were killed and 12 were hurt in the attack. The gunmen were suspected to be members of the rebel ""Ninja"" group.",1,1,1,2,Ninjas,3
2002,33.208716,35.572618,04/02/2002: Members of the Lebanese group Hizballah fired a katyusha rocket near the Israeli city of Kiryat Shmona in the Upper Galilee region. There were no casualties. The rocket was found in an open field. Hizballah later denied firing the rocket.,1,1,1,3,Hezbollah,0
2002,43.296482,5.36978,"04/02/2002: Two unknown assailants threw a Molotov cocktail at a Marseille synagogue. The cocktail landed near two police guards. No one was injured, and no suspects were found.",1,1,1,3,Unknown,0
2002,48.605192,7.748562,04/02/2002: Arsonists set fire to a Jewish cemetary pavilion in the French town of Schiltigheim. Most of the building was destroyed. There were no causalties or injuries. No suspects have been found.,1,1,1,7,Unknown,0
2002,43.2572,46.243,"04/02/2002:  Three Russian troops died when they ate fruit contaminated with an unknown chemical in Novograzonskoye, Chechnya.",1,1,1,8,Unknown,3
2002,-3.648426,128.16576,"04/03/2002: A car bomb exploded in the city of Ambon, in the Maluku province of Indonesia. 4 were killed, and 58 were injured. There were no confirmed suspects.",1,1,1,3,Unknown,4
2002,35.54987,45.433493,"04/03/2002: Two gunmen attempted to assasinate Barham Salih, head of the Patriotic Union of Kurdistan's regional government, by firing at him at his home in the city of Sulaymaniyah. Both gunmen and five of Salih's bodyguards were killed. Salih escaped unharmed. The gunmen were suspected to be members of the rebel group Jund al-Islam.",1,1,1,1,Ansar al-Islam,7
2002,6.530155,-10.344176,"4/3/2002: Approximately 100 members of Liberians United for Reconciliation and Democracy (LURD) attacked the town of Kakata, Margibi County, Liberia.  They succeeded in taking temporary control of the town until Liberian soldiers beat them back.  At least three civilians were killed in the attack and hundreds of residents fled.  Buildings and vehicles were burnt in the battle between rebels and troops.  The incident was part of LURD's campaign to oust President Charles Taylor; the town is a strategic stronghold.",1,1,1,9,Liberians United for Reconciliation and Democracy (LURD),3
2002,6.95284,-71.87514,"4/3/2002:  Suspected members of Revolutionary Armed Forces of Colombia (FARC) kidnapped the mayor of Saravena, Arauca Department, Colombia.  Mayor Jose Trinidad Sierra, along with three councilmen, were abducted by armed assailants.  No ransom demands were made.",1,1,1,6,Revolutionary Armed Forces of Colombia (FARC),0
2002,7.869039,126.374112,04/04/2002: Sixty troops from the Philippino 60th Infantry battalion discovered a 100-man force of the New People's Army (NPA) outside of Boston Town in Davao Oriental province. It is not known which side began the ensuing firefight. 10 NPA members were killed overnight. 5 Philippino soldier were killed and seven others were injured.,1,1,0,2,New People's Army (NPA),15
2002,48.810112,2.356948,04/04/2002: Two Molotov cocktail fire bombs were thrown at the synagogue in the Paris suburb of Kremlin-Bicetre. The fire bombs missed the synagogue and hit the sidewalk. None were injured. Police arrested three unidentified suspects who admitted to the attack.,1,1,1,3,Unaffiliated Individual(s),0
2002,33.322121,35.642361,"04/04/2002: Three unarmed UN observers entered a Hizballah checkpoint at the village of Mari in the disputed Sheba'a Farms area of Lebanon. An argument ensued, with the suspected Hizballah members beating up the UN obervers. None of the observers were killed, and no charges were brought on the Hizballah fighters.",0,1,1,8,Hezbollah,0
2002,48.583148,7.747882,04/05/2002: Police discovered an unexploded bomb in a Jewish cemetary near Strasbourg-Cronenbourg. The bomb was removed and no one was injured. There were no suspects.,1,1,1,3,Unknown,0
2002,4.243193,-75.241121,"5/4/2002: Approximately 100 members from Revolutionary Armed Forces of Colombia (FARC) attacked the town of Rovira, Tolima Department, Colombia.  The assailants detonated explosive devices at the police station, a bank, and various other public buildings and private homes.  They also planted mines on access roads leading into Rovira.  A soldier and a police officer were killed in the attack and two civilians were wounded.",1,1,1,3,Revolutionary Armed Forces of Colombia (FARC),2
2002,4.15127,-73.63872,"4/7/2002: A car bomb exploded in the busy entertainment district of Villavicencio, Meta department, Colombia.  A smaller device exploded first, drawing a crowd; it was followed by a powerful car bomb that damaged nearby buildings.  At least twelve people were killed and at least another 70 were injured.  No group claimed responsibility for the incident; however, authorities speculate that Revolutionary Armed Forces of Colombia (FARC) were involved.",1,1,1,3,Revolutionary Armed Forces of Colombia (FARC),12
2002,34.434167,70.447778,"04/08/2002: A bomb exploded 10 meters from the car carrying Afghan Defense Minister General Mohammad Qasim Fahim. Fahim survived, but 10 civilians were killed and approximately 80 civillians injured. Al Qa'ida later claimed responsibility.",1,1,1,3,Al-Qaida,10
2002,33.371715,74.315313,"4/8/2002: A bomb exploded in a sweets shop in Rajouri, Jammu and Kashmir, India.  At least two people were killed and at least 12 were injured; in addition, the back of the shop was destroyed in the explosion.  Authorities believe that Muslim militants are responsible for the incident.",1,1,1,3,Muslim Militants,2
2002,33.032216,75.910031,"4/9/2002: Muslim militants attacked a family near Gandoh, Jammu and Kashmir, India.  The assailants came to the house of Noor Gujjar, whom they suspected of collaborating with security forces. Noor Gujjar was not home at the time of the incident; however, the assailants opened fire on Gujjar's Muslim family members.  Five people were killed and four more were injured.",1,1,1,2,Muslim Militants,5
2002,4.5981,-74.07603,"4/9/2002: An improvised explosive device detonated outside of a bookstore in Bogota, Distrito Capital, Colombia.  The device consisted of explosives packed into a gas cylinder.  At least one person was injured in the attack.  Authorities blame the Revolutionary Armed Forces of Colombia (FARC) for the incident.  This was one of several bombs that were attributed to FARC that day.",1,1,1,3,Revolutionary Armed Forces of Colombia (FARC),0
2002,4.5981,-74.07603,"4/9/2002: An improvised explosive device detonated outside of a cellular phone store in Bogota, Distrito Capital, Colombia.  The device consisted of explosives packed into a gas cylinder.  At least one person was injured in the attack.  Authorities blame the Revolutionary Armed Forces of Colombia (FARC) for the incident. This was one of several bombs that were attributed to FARC that day.",1,1,1,3,Revolutionary Armed Forces of Colombia (FARC),0
2002,4.5981,-74.07603,"4/9/2002: An improvised explosive device detonated outside of an apartment building in Bogota, Distrito Capital, Colombia.  The device consisted of explosives packed into a gas cylinder.  At least one person was injured in the attack.  Authorities blame the Revolutionary Armed Forces of Colombia (FARC) for the incident.  This was one of several bombs that were attributed to FARC that day.",1,1,1,3,Revolutionary Armed Forces of Colombia (FARC),0
2002,4.5981,-74.07603,"4/9/2002: A bomb-sniffing dog uncovered an explosive device in Bogota, Distrito Capital, Colombia.  Experts safely defused the device.  Authorities blame the Revolutionary Armed Forces of Colombia (FARC) for the failed attempt.  This was one of several bombs that were attributed to FARC that day.",1,1,1,3,Revolutionary Armed Forces of Colombia (FARC),0
2002,27.930484,82.330002,"04/11/2002: A group of rebel Maoists attacked the Nepal Armed Police Force outpost near Sadbariya in the Dang District. 84 police officers, four civilians, and approximately 62 rebels were killed in the attack. The exact motive is unknown.",1,1,0,2,Unknown,170
2002,32.793921,34.990615,04/11/2002: Mohammed Daragmah detonated a suicide bomb on a bus leaving the northern Israeli city of Haifa. Daragmah and nine civilians were killed.,1,1,1,0,Unaffiliated Individual(s),10
2002,33.819136,10.855024,"04/11/2002: At 9:35 a.m., Nizar Naouar, a Tunisian man, rammed an old Iveco tanker truck filled with 5,000 liters of liquid gas into the Ghriba synagogue on the Tunisian vacation island of Djerba. The resulting explosion killed twenty-one people, including 14 Germans, two French tourists and five Tunisians. In addition to the attacks’ casualties, the suicide bomber was also killed. Al-Qaida claimed responsibility for the attack in two televised interviews to arab language media.",1,1,1,0,Al-Qaida,21
2002,33.807598,10.845147,"4/11/2002: A truck filled with cooking oil smashed into the El Ghriba Jewish shrine on Djerba island, Tunisia.  At least nine people were killed in the explosion and another 20 were injured.  Authorities state that the incident was an accident; however, witnesses and the Israel Foreign Ministry believe the incident was intentional.  No group has claimed responsibility for the incident.",1,1,1,3,Unaffiliated Individual(s),10
2002,33.371715,74.315313,"11/4/2002: A grenade exploded at the Sharan Hotel in Rajouri, Jammu and Kashmir, India.  At least fourteen people were injured in the explosion.  No group has claimed responsibility for the incident and motive is unknown.",1,1,1,3,Unknown,0
2002,33.702222,74.218611,"11/4/2002: Militants threw a grenade at a vehicle that was traveling near Lassana village, Jammu and Kashmir, India.  When the vehicle stopped, the heavily armed militants opened fire.  The vehicle was transporting the body of Mohammad Sadiq, who had died from an accident that day.  Four people were killed and one person was injured in the attack; all of the victims were Muslim.  No group has claimed responsibility for the incident and motive is unknown.",1,1,1,3,Militants,4
2002,34.533056,69.166111,04/12/2002: Approximately 30 armed rebels wearing police uniforms attacked a British contingent of the International Security Assistance Force. Seven attackers were captured. There were no casualties.,1,1,1,2,Unknown,0
2002,54.258808,-5.606616,"04/12/2002: An explosion occurred at the Ardglass police station in County Down, Northern Ireland. There were no casualties, but 30 homes were evacuated. There were no suspects. Earlier explosions occurred at the Downpatrick police station.",1,1,1,3,Unknown,0
2002,54.328629,-5.716669,"04/12/2002:Two explosions occurred at the Downpatrick police station in County Down, Northern Ireland. No one was injured, but a small hole was found in the outer fence. There were no suspects. An explosion later occurred at the Ardglass police station.",1,1,1,3,Unknown,0
2002,33.371614,74.315191,"04/12/2002: Armed men attacked the Indian Border Security Force camp at Gaibas Village in the Rajouri District. Two BSF members were killed and another was injured in the attack. The suspects escaped, but one was killed in later search operations. No one was arrested in connection with the attack.",1,1,1,2,Unknown,3
2002,31.784936,35.212719,"04/12/2002: Andaleeb Tawataqah detonated a suicide bomb near the Mahane Yehuda outdoor market in Jerusalem. Tawataqah and six civilians were killed. 50 were injured. No group had claimed responsibility, but Tawataqah recorded a video prior to the explosion wearing the uniform of the Al Aqsa Martyrs Brigade.",1,1,1,0,Al-Aqsa Martyrs Brigade,7
2002,15.328695,44.214171,"04/12/2002: An explosion occurred in the Sheraton district of Sanaa, near the US Embassy. Though police believed the blast targeted a Yemeni intelligence officer and not the embassy, a group identifying as Sympathizers of Al-Qa'ida distributed pamphlets throughout Sanaa claiming responsibility for attempting to hit the embassy. No one was arrested.",1,1,1,3,Sympathizers of Al-Qaida Organization,0
2002,31.556789,34.538903,"4/12/2002: At least one Palestinian gunman opened fire and hurled a grenade at the Erez border crossing in Gaza Strip, West Bank and Gaza Strip.  One Israeli and one Palestinian were killed in the incident; another three Israelis and three Palestinians were injured.  The assailant was also killed.  The Islamic Jihad claimed responsibility for the attack.",1,1,1,3,Palestinian Islamic Jihad (PIJ),3
2002,33.292887,35.725963,04/13/2002: Hizballah fired anti-tank rockets and mortar shells at Israeli Defense Forces position in Har Dov in the Golan Heights region. There were no casualties.,1,1,0,3,Hezbollah,0
2002,29.617011,81.603566,04/13/2002: A bomb was detonated near a school in Latinbazaar in the Bajura District of Nepal. Three children were killed and four others were injured. No suspects have been found.,1,1,1,3,Unknown,3
2002,,,"04/13/2002: United States and Afghan coalition forces were attacked by approximately 20 militants. No Coalition forces were killed. Air support was called in, and 5 militants were killed.",1,1,1,2,Taliban,5
2002,33.331806,69.951693,"04/13/2002: Rocket-propelled grenades were fired at the airbase in Khost, Afghanistan. The number of dead or injured was unknown. No one was capture and none claimed responsibiltiy.",1,1,1,3,Unknown,0
2002,36.71499,3.05002,"4/13/2002: Unknown perpetrators, believed to be affiliated with the Islamic insurgency in Algeria, detonated two homemade bombs near a bus stop at the central square of Birkhadem, Algeria.  Nine Algerian civilians were wounded by the blast.",1,1,1,3,Algerian Islamic Extremists,0
2002,10.981412,-74.778319,"04/14/2002: A car-bomb exploded along Colombian Presidential Candidate Alvaro Uribe Velez's campaign route in Barranquilla as he traveled to the Port Authority headquarters. The bomb destroyed Uribe's armored car and a bus. Uribe was not killed. There were 3 civilian causalties and approximately 20 injured. There were no claims of responsibility, though the Fuerzas Armadas Revolucionarias de Colombia (FARC)is suspected.",1,1,1,1,Revolutionary Armed Forces of Colombia (FARC),3
2002,25.92,93.73,"4/14/2002: A bomb exploded at Dimapur, Nagaland state, India.  Two people were killed in the explosion and two more were injured.  One of those killed was a leader for National Socialist Council of Nagaland Isak-Muivah (NSCM[I-M]).  The explosive device was ""foreign made"".  No group claimed responsibility and the motive is unknown.",1,1,1,3,Unknown,2
2002,28.210638,84.742003,"04/15/2002: An unknown number of unknown rebels attacked the police station in Barpak Village. Four guerillas, nine policemen and a civillian were killed before the rebels destroyed the building and stole firearms. There were no arrests.",1,1,1,2,Unknown,14
