iyear,latitude,longitude,summary,crit1,crit2,crit3,attacktype1,gname,nkill2002,31.617667,65.675942,"5/31/2002: A bomb exploded outside of the palace of the governor of Kandahar, Gul Agha, in Kandahar city, Afghanistan.  One person was injured in the explosion and the area suffered minor damage.  No group claimed responsibility for the incident and motive is unknown; however, authorities suspect the attack was intended to disrupt the selection of provincial delegates for the national grand council.",1,1,1,3,Unknown,0
2002,7.6676,-76.6803,06/02/2002: The Fuerzas Armadas Revolucionarias de Colombia (FARC)were thought to be behind explosions which killed 9 and injured 23 in the town of Chicorodo.,1,1,1,3,Revolutionary Armed Forces of Colombia (FARC),9
2002,54.597269,-5.930109,06/02/2002: An outbreak of sectarian violence in Belfast between members of the Provisional IRA and the Ulster Volunteer Force in East Belfast led to 3 Protestant men being shot.,0,1,1,2,Irish Republican Army (IRA),0
2002,4.845447,-74.622546,06/03/2002: The Fuerzas Armadas Revolucionarias de Colombia (FARC)unsuccessfully attempted to detonate a 40-pound cylinder bomb in the Police Station in Cundinmarca,1,1,1,3,Revolutionary Armed Forces of Colombia (FARC),0
2002,25.764367,-80.201529,"06/03/2002: Molotov Cocktails consisting of Miller beer bottles filled with gasoline and stuffed with burning rags were thrown at the Cuban-American National Foundation headquarters at 1312 SW 27th Ave., Miami, Florida, U.S.A. . Authorities believe that an earlier Molotov Cocktail attack on the Alpha 66 headquarters at 1714 W. Flagler St. is related to this incident. Leaders of both groups suspect that the ""hand of Castro"" was behind the attacks and Cuban spies carried out the attack.",1,1,1,7,Unknown,0
2002,25.764367,-80.201529,"06/03/2002: The headquarters of exile paramilitary group Alpha 66 in Miami, Florida, U.S.A. was hit by Molotov Cocktails. Authorities believe that this incident is related to a subsequent Molotov Cocktail attack on the Cuban-American National Foundation headquarters. Leaders of both groups suspect that the ""hand of Castro"" was behind the attacks and Cuban spies carried out the attack.",1,1,1,7,Unknown,0
2002,9.337295,-73.653621,"3/5/2002: Members of Revolutionary Armed Forces of Colombia (FARC) set up a roadblock in Cesar Department, Colombia. The assailants burned several vehicles, stole a trailer truck full of food, and kidnapped nine people.  The outcome of the kidnapping is unknown.",1,1,1,6,Revolutionary Armed Forces of Colombia (FARC),0
2002,5.973652,-75.361345,"5/31/2002: Members of National Liberation Army of Colombia (ELN) kidnapped three men in La Union, Antioquia Department, Colombia.  The motive behind the kidnapping is unknown.",1,1,1,6,National Liberation Army of Colombia (ELN),0
2002,13.391652,99.389511,06/04/2002: Unknown gunmen opened fired targeting civilians on a school bus in Ban Kha in Ratchaburi province. Three were killed and twelve were wounded,1,1,1,2,Unknown,3
2002,36.611839,4.063158,06/04/2002: A home-made bomb targeting civilians wounded 4 children in the Algerian town of Ait Mesbah. No group has taken credit for the attack.,1,1,1,3,Unknown,0
2002,43.54920241,45.2293148,06/04/2002: The explosion of a landmine along the Goragorsk-Mozdok highway wounded 2 policemen in Chechnya. The incident has not been attributed to any specific rebel group.,1,1,1,3,Chechen Rebels,0
2002,2.19716,-75.98108,"4/6/2002: Suspected members of Revolutionary Armed Forces of Colombia (FARC) entered a village church and shot and killed the priest who was conducting Mass in La Argentina, Huila Department, Colombia.  Five assailants opened fire on Juan Ramon Nunez, killing him and one of his parishioners.  The motive behind the incident is unknown.",1,1,1,2,Revolutionary Armed Forces of Colombia (FARC),2
2002,-3.382942,29.367103,"06/05/2002: Rebels of the Forces Nationales de Libération (FLN - National Liberation Forces) detonated grenades and burned homes in Bujumbura, the capital of Burundi. Six civilians were wounded.",1,1,1,3,Party for the Liberation of the Hutu People (PALIPEHUTU),0
2002,32.588358,35.186748,"06/05/2002: A suicide bombing targeting citizens during the morning rush hour killed 17 people and wounded an additional 40 in Megiddo junction, Israel. Islamic Jihad claimed responsibility for the attack.",1,1,1,0,Palestinian Islamic Jihad (PIJ),17
2002,37.97918,23.716647,06/05/2002: The terrorist outfit Popular Resistance (Laiki Antistasi) claimed responsibility for a bomb attack on the offices of an insurance company in Athens. No one was reported hurt.,1,1,1,3,Popular Resistance (Laiki Antistasi),0
2002,-1.393147,120.754749,06/06/2002: A bomb exploded inside a bus near the town of Mapene killing 4 people and injuring 17 others. No group claimed responsibility for the attack.,1,1,1,3,Unknown,4
2002,0.873889,-75.618611,"06/06/2002: The mayor of the Colombian town of Solita, Luis Carlos Caro Pacheco, was killed. Local officials have pinned the murder on the Fuerzas Armadas Revolucionarias de Colombia (FARC) (FARC).",1,1,1,1,Revolutionary Armed Forces of Colombia (FARC),1
2002,4.597909,-74.076086,06/06/2002: An explosion killed one and wounded 10 in a restaurant bathroom in Bogota. No group has claimed responsibility for the attack and authorities believe the bombing was the end result of failed extortion.,1,1,1,3,Unknown,1
2002,43.2432,45.1807,"06/06/2002: Chechen Rebels (non-specific) kidnapped two officials in Assinovskaya, a village in the Achkhoy-Martanovsky region.",1,1,1,6,Chechen Rebels,0
2002,3.289549,32.882019,06/06/2002: Rebels of the Lord’s Resistance Army (LRA) set fire to a disco and a number of homes in the northern Ugandan village of Anwar.,1,1,1,7,Lord's Resistance Army (LRA),0
2002,43.166667,45.616667,06/06/2002: Chechen rebels unsuccessfully attempted to kidnap an administrative official in the village of Shalazi in the Urus-Martan district.,1,1,1,6,Chechen Rebels,2
2002,32.033627,35.263893,"6/6/2002: A Palestinian gunman shot and killed a student as he was driving near Sinjil village, West Bank, West Bank and Gaza Strip.  Erez Rund was returning home from Eli when the vehicle he was in was hit by four bullets; none of the other passengers were injured in the attack.  The gunman fled and no group claimed responsibility for the incident.",1,1,1,2,Unaffiliated Individual(s),1
2002,43.36174637,45.4109993,06/07/2002: Chechen rebels first used radio-controlled mines and then grenade launchers to attack a federal convoy of Russian troops traveling from Groznyy to Alkhan-Yurt. Nine troops were killed.,1,1,1,3,Chechen Rebels,9
2002,54.863117,-6.278343,06/07/2002: Operatives with the Real Irish Republican Army (RIRA) unsuccessfully detonated a bomb under the car of a Catholic police recruit in the town of Ballymena in Northern Ireland.,1,1,1,3,Real Irish Republican Army (RIRA),0
2002,36.4488,2.77596,"6/7/2002: Twelve perpetrators, believed to be affiliated with the Islamic insurgency in Algeria, shot and killed Ali Ouedfel and his wife at their home in Taberranet, Algeria.  Their son, a member of the Legitimate Defense Group (GLD), was wounded as he engaged the assailants in a firefight.  Before fleeing, the Islamic extremists placed a bomb at the house which was located and defused by Algerian security forces.  It is unclear whether Ali Ouedfel and his wife were targeted for a specific reason or if the perpetrators intended to kill Algerian civilians at random.",1,1,1,3,Algerian Islamic Extremists,2
2002,35.759773,-0.072341,"6/7/2002: Around ten perpetrators, believed to be affiliated with the Islamic insurgency in Algeria, slit the throats of four shepherds on a farm in Louza, Algeria.",1,1,1,2,Algerian Islamic Extremists,4
2002,31.533586,35.099814,06/08/2002: HAMAS extremists killed two Israeli settlers and one policeman in the southern West Bank town of Hebron.,1,1,1,2,Hamas (Islamic Resistance Movement),3
2002,31.283213,34.252287,06/08/2002: Operatives with the military wing of HAMAS detonated a large bomb near the town of Rafah in the West Bank. The bomb detonated accidentally and killed three militants.,1,1,1,3,Hamas (Islamic Resistance Movement),3
2002,-19.395855,31.901795,06/08/2002: Young rebels associated with the Movement for Democratic Change (MDC) bombed and burnt down a store belonging to a Zanu-PF member in Buhera.,1,0,1,2,Movement for Democratic Change (MDC),0
2002,32.168764,35.235864,06/09/2002: The Democratic Front for the Liberation of Palestine (DFLP) has claimed responsibility for a raid in the Israeli settlement of Yithar that wounded four Israeli Defense Force soldiers.,1,1,1,2,Democratic Front for the Liberation of Palestine (DFLP),1
2002,-6.208821,106.846046,"6/9/2002: An improvised device exploded outside of the Exotic Discotheque in Jakarta, Jakarta province, Indonesia.  At least four people were injured in the explosion and an outdoor stall was destroyed.  The device was similar to two other devices found in Jakarta that night: they are believed to be linked.  No group claimed responsibility for the incident and specific motive is unknown; however, Muslim extremists have targeted discotheques in the past that they perceived as un-Islamic.",1,1,1,3,Muslim Extremists,0
2002,-6.208821,106.846046,"6/9/2002: A parking attendant discovered an improvised explosive device in a parking lot outside of a discotheque in Jakarta, Jakarta province, Indonesia.  Police safely defused the device and no one was injured.  The device was similar to two other devices found in Jakarta that night; they are believed to be linked.  No group claimed responsibility for the incident and specific motive is unknown; however, Muslim extremists have targeted discotheques in the past that they perceived as un-Islamic.",1,1,1,3,Muslim Extremists,0
2002,-6.208821,106.846046,"6/9/2002: An explosive device was discovered in a parking lot outside of a department store in the entertainment district of Jakarta, Jakarta province, Indonesia.  Police safely defused the device and no one was injured.  The device was similar to two other devices found in Jakarta that night; they are believed to be linked.  No group claimed responsibility for the incident and specific motive is unknown; however, Muslim extremists have targeted entertainment clubs in the past that they perceived as un-Islamic.",1,1,1,3,Muslim Extremists,0
2002,13.560981,123.374843,06/10/2002: Rebels associated with the New People’s Army (NPA) killed a chieftain from Salvacion Village in Ocampo after he refused not to run for political office in the area.,1,1,1,1,New People's Army (NPA),1
2002,13.560981,123.374843,06/10/2002: Rebels associated with the New People’s Army (NPA) shot and killed a chieftain from Buenavista Village in Ocampo after he refused not to run for political office in the area.,1,1,1,1,New People's Army (NPA),1
2002,32.174847,34.803366,06/11/2002: A suicide bomber blew himself up outside a restaurant in the Israeli town of Herzliya killing 2 and wounding another 15. No group has claimed responsibility.,1,1,1,0,Unknown,2
2002,31.533586,35.099814,06/11/2002: A bomb explosion in an orchard in Hebron injured 3 Israeli teenagers. No group has claimed responsibility for the attack.,1,1,1,3,Unknown,0
2002,42.9537,46.113,06/11/2002: Chechen rebels employed grenade launchers and small arms to attack a prominent Russian official’s home in the town of Vedeno.,1,1,1,1,Chechen Rebels,2
2002,6.190088,101.797961,06/11/2002: Gunmen thought to be part of the guerrilla group Barisan Revolusi Nasional (BRN) by authorities killed two policemen on duty in the Thai province of Narathiwat.,1,1,1,2,Barisan Revolusi Nasional (BRN),2
2002,36.265263,2.753912,"6/11/2002: Islamists opened fire on a bus in Medea, Medea province, Algeria.  Twelve people were killed in the attack and nine were injured.  No group claimed responsibility for the incident and motive is unknown.",1,1,1,2,Muslim Extremists,12
2002,36.266667,2.75,"6/12/2002: Suspected members of the Armed Islamic Group (GIA) set up a fake roadblock on a road near Médéa, Algeria.  The assailants fired into a coach bus killing twelve passengers and wounding nine others.",1,1,1,2,Armed Islamic Group (GIA),12
2002,36.20556,2.0792,06/13/2002: A home-made bomb targeting civilians exploded in a cafe in the Algerian city of Djelida injuring 14 people.,1,1,1,3,Unknown,0
2002,42.479623,21.740599,06/13/2002: A hand grenade was thrown into the yard of an Albanian administrator in the village of Veliki Trnovac. No one was harmed in the attack.,1,1,1,3,Unknown,0
2002,-2.876069,29.203409,06/14/2002: Rebels in Burundi attacked a bus in Cibitoke Province. The gunfire killed 14 and wounded another 10.,1,1,1,2,Unknown,14
2002,24.893379,67.028061,06/14/2002: A suicide bombing in front of the U.S. Consulate in Karachi left 12 dead and another 51 injured. Tarjuman Al-Qanoon has taken responsibility for the bombing.,1,1,1,0,Lashkar-e-Omar,12
2002,5.336134,-74.303539,06/14/2002: Rebels with the Fuerzas Armadas Revolucionarias de Colombia (FARC)shot down a helicopter carrying 360 million pesos to the Agrarian Bank in Topaipi. Five policemen were killed and three have gone missing.,1,1,1,4,Revolutionary Armed Forces of Colombia (FARC),5
2002,-18.92232,47.51724,06/14/2002: Unidentified assailants launched hand grenades into the home of a Madagascar government official. The attack was thought to be retribution for support of pro-government demonstrations months prior.,1,1,1,3,Unknown,0
2002,5.5212,95.5531,"6/13/2002: Two unidentified gunmen shot and killed Nasri Zamzam at his home in Alue Glong village, Aceh province, Indonesia.  Zamzam was a legislative member of the Indonesian United Party.  A witness reports that Zamzam had a conversation with the gunmen before he was shot, giving the impression that he knew them.  Authorities blame Free Aceh Movement (GAM) for the incident; GAM denies involvement and claims the authorities orchestrated the attack.",1,1,1,1,Free Aceh Movement (GAM),1
2002,36.67,2.94444,"6/14/2002: In a series of two related attacks, three suspected members of the Armed Islamic Group (GIA) invaded a residence at the El Makam housing estates in  Douéra, Algeria and proceeded to shoot and kill six Algerian civilians.  One other civilian was wounded in the incident.",1,1,1,2,Armed Islamic Group (GIA),6
2002,36.67,2.94444,"6/14/2002: In a series of two related attacks, three suspected members of the Armed Islamic Group (GIA) shot and killed six Algerian civilians at the Es Salam housing estates in Douéra, Algeria.",1,1,1,2,Armed Islamic Group (GIA),6
2002,34.083658,74.797368,"06/15/2002: Militants with the group Al-Madina [LeT Front] fired two rocket propelled grenades at a building housing the chief minister of Indian Kashmir, Farooq Abdullah. No one was harmed.",1,1,1,1,Al-Madina,0
2002,32.726602,74.857026,06/15/2002: Islamic radicals threw grenades and shot at Hindu pilgrims in the Kisthwar region of Jammu in Kashmir. Six people were killed and another 7 were left wounded by the attack.,1,1,1,3,Unknown,6
2002,31.573713,34.489043,06/15/2002: Palestinian gunmen opened fire on members of the Israeli Defense Forces near Dugit settlement in the Gaza Strip. The military wing of HAMAS claimed responsibility for the attack which killed two Israelis and one Palestinian.,1,1,1,2,Hamas (Islamic Resistance Movement),3
2002,-18.92232,47.51724,06/15/2002: Unidentified assailants launched hand grenades into the home of a Madagascar presidential spokesperson. The attack was thought to be retribution for support of pro-government demonstrations months prior.,1,1,1,3,Unknown,0
2002,32.925224,75.135264,"6/16/2002: Muslim separatists attacked villagers in Balmakote, Jammu and Kashmir, India.  The assailants entered the villagers' homes and opened fire, killing five Hindus and wounding three others.  No group claimed responsibility and specific motive is unknown.",1,1,1,2,Muslim Separatists,5
2002,31.754684,35.211556,06/17/2002: HAMAS claimed responsibility for a suicide attack that decimated a bus in Southern Jerusalem. A total of 18 citizens were killed and another 48 were left wounded.,1,1,1,0,Hamas (Islamic Resistance Movement),19
2002,37.97918,23.716647,06/17/2002: A hand grenade attack damaged the office of a Panhellenic Socialist Party official in Athens. No one was wounded and the Popular Resistance (Laiki Antistasi) claimed responsibility for the incident.,1,1,1,1,Popular Resistance (Laiki Antistasi),0
2002,5.408299,-73.295907,06/17/2002: A dynamite attack damaged the multinational Drummond railway system in between the Cienaga and Papare terminals. Officials believe the 19th Front of the Fuerzas Armadas Revolucionarias de Colombia (FARC)were responsible.,1,1,1,3,Revolutionary Armed Forces of Colombia (FARC),0
2002,32.543715,35.201409,06/17/2002: A Palestinian suicide bomber blew himself up near the Arab-Israeli village of Kafr Salem. Authorities believe the attack was in retaliation for the government’s decision to construct a security fence along the West Bank. No group claimed responsibility for the attack.,1,1,1,0,Unknown,1
2002,6.420453,121.972908,06/17/2002: Abu Sayyaf rebels captured and beheaded 2 Muslims in Basilan who they had suspected were in aid of the Philippine military against Al-Qaeda.,1,1,1,2,Abu Sayyaf Group (ASG),2
2002,6.05519,121.001323,06/17/2002: Rebels kidnapped 4 Indonesian sailors from a boat off the coast of the Philippine island of Jolo. The Philippine Armed Forces suspected Abu Sayyaf in the abduction.,1,1,1,6,Abu Sayyaf Group (ASG),0
2002,0.516746,25.19994,06/17/2002: Members of the Rally for Congolese Democracy (RCD) kidnapped and beat 2 UN officials working in the country. The act was condemned by the Secretary General Kofi Annan.,1,1,1,2,Congolese Rally for Democracy (RCD),0
2002,1.637898,-77.745208,"6/16/2002: Approximately 80 members of National Liberation Army of Colombia (ELN) attacked an equestrian fair in Narino Department, Colombia.  The assailants surrounded the fair and took at least ten people hostage.  One of the hostages was former deputy minister Alberto Benavides.  The captives were taken into the mountains and the outcome of the kidnapping is unknown.",1,1,1,6,National Liberation Army of Colombia (ELN),0
2002,36.772371,5.610315,"6/17/2002: Unknown perpetrators, believed to be affiliated with the Islamic insurgency in Algeria, ambushed Algerian soldiers on a road in El-Aouana, Algeria.  Two soldiers were killed and five others were wounded.",1,1,0,9,Algerian Islamic Extremists,2
2002,30.197843,71.467629,"6/17/2002: Two unidentified gunmen opened fire on Shiite Muslims at Al-Hussaini mosque in Multan, Punjab province, Pakistan.  Three people were killed in the shooting.  The assailants fled on a motorcycle and no group claimed responsibility for the incident.  Specific motive is unknown; however, authorities suspect that attack was sectarian.",1,1,1,2,Gunmen,3
2002,31.786188,35.232791,06/19/2002: A suicide bomber killed himself and 6 others at a bus stop in the Jewish settlement of French Hill in East Jerusalem. HAMAS claimed responsibility for the attack.,1,1,1,0,Hamas (Islamic Resistance Movement),7
2002,41.709981,44.792998,"06/19/2002: The director of the Georgian Argobusinessbank, a British national, was kidnapped in Tbilisi by criminals dressed in police uniforms.",1,1,1,6,Unknown,0
2002,24.64732,46.714581,06/20/2002: A car bomb detonated and killed a British employee of the Saudi-French Bank in Riyadh. No group has claimed responsibility.,1,1,1,3,Unknown,1
2002,32.174012,35.308052,06/20/2002: Gunmen with the Popular Front for the Liberation of Palestine (PFLP) killed 6 Israelis in the city of Nablus in the West Bank.,1,1,1,2,Popular Front for the Liberation of Palestine (PFLP),7
2002,55.75,37.616667,06/20/2002: An attempt on the life of a Russian Deputy Mayor of Moscow proved unsuccessful. The Deputy Mayor was not harmed but one of the assailants was killed by the return fire.,1,1,1,1,Unknown,1
2002,-18.92232,47.51724,06/20/2002: Rebels attacked the hangar holding an aircraft and helicopters of a presidential candidate with rocket launchers at Antananarivo Ivato airport. No one was harmed and the assailants fled.,1,1,1,3,Unknown,0
2002,6.816467,-11.136261,06/20/2002: Rebels with the Liberians United for Reconciliation and Democracy (LURD) abducted 6 nurses from the town of Sinje. The UN arranged for the release of the hostages.,1,1,1,6,Liberians United for Reconciliation and Democracy (LURD),0
2002,9.59953,122.470532,06/20/2002: Four commuter busses were burned in the Philippine town of Hinobaan. The New People’s Army (NPA) has claimed responsibility for the incident citing a desire to economically damage the owners of the bus line.,1,1,1,7,New People's Army (NPA),0
2002,36.539004,-4.624353,06/21/2002: A car bombing attributed to the separatist group Basque Homeland and Freedom (ETA) exploded in the Spanish town of Fuengirola. Three British citizens were injured in the attack.,1,1,1,3,Basque Fatherland and Freedom (ETA),0
2002,37.97207,23.747145,06/21/2002: A bomb exploded under a car registered to the Egyptian Embassy in the Pagrati neighborhood of Athens. No one was harmed and no group claimed responsibility.,1,1,1,3,Unknown,0
2002,36.509937,-4.886352,06/21/2002: A car bombing attributed to the separatist group Basque Homeland and Freedom (ETA) exploded in the Spanish town of Marbella. No one was hurt.,1,1,1,3,Basque Fatherland and Freedom (ETA),0
2002,3.288485,32.87895,06/21/2002: Members of the Lord’s Resistance Army (LRA) fired on the regional police chief's vehicle near Paico village. One policeman was killed and three other individuals were wounded in the attack.,1,1,1,3,Lord's Resistance Army (LRA),1
2002,36.16525,1.33452,"6/21/2002: In a series of two related attacks, suspected members of the Armed Islamic Group (GIA) detonated a bomb at a park in Chlef, Algeria.  One Algerian civilian was killed and it is unknown if the blast caused any property damage.",1,1,1,3,Armed Islamic Group (GIA),1
2002,36.16525,1.33452,"6/21/2002: In a series of two related attacks, suspected members of the Armed Islamic Group (GIA) detonated a bomb at a busy market in Chlef, Algeria.  Three individuals were killed and twenty-eight others were wounded.  It is unknown if the blast caused any property damage.",1,1,1,3,Armed Islamic Group (GIA),3
2002,43.46096,-3.807934,"06/22/2002: A bombing attributed to separatist group Basque Homeland and Freedom (ETA) exploded in the Spanish town of Santander damaging 11 vehicles, a ministry building and wounding a member of the National Police Force.",1,1,1,3,Basque Fatherland and Freedom (ETA),0
2002,41.656285,-0.876533,06/22/2002: A car bombing attributed to separatist group Basque Homeland and Freedom (ETA) exploded in a car park in the Spanish town of Zaragoza. Three people were injured by the blast.,1,1,1,3,Basque Fatherland and Freedom (ETA),0
2002,36.8075,6.1235,"6/22/2002: Unknown perpetrators, believed to be affiliated with the Islamic insurgency in Algeria, planted a bomb that killed two farmers in Beni H'bibi, Algeria.  It is unknown if the farmers were the specific target of the bomb or if the assailants intended to target Algerian civilians at random.",1,1,1,3,Algerian Islamic Extremists,2
2002,36.595699,-4.637617,06/23/2002: A car bombing attributed to the separatist group Basque Homeland and Freedom (ETA) exploded in the Spanish town of Mijas outside of a hotel. There were no injuries reported.,1,1,1,3,Basque Fatherland and Freedom (ETA),0
2002,36.716667,2.85,06/23/2002: Unknown gunmen opened fire at a seaside resort in Zeralda killing 6 teenagers playing soccer and wounding 3 others.,1,1,1,2,Unknown,6
2002,34.083658,74.797368,06/23/2002: Two grenades exploded outside of a building housing 500 members of the ruling National Conference party in Sriringar. No one was harmed. The groups Hizb-ul-Mujahidin (HM) and Al-Madina [LeT Front] both claimed responsibility for the attack.,1,1,1,3,Hizbul Mujahideen (HM),0
2002,36.07791,1.10583,"6/23/2002: Suspected members of the Armed Islamic Group (GIA) planted a bomb on a road in Boukabene, Algeria.  The explosive device was discovered by Algerian security forces and subsequently defused.",1,1,1,3,Armed Islamic Group (GIA),0
2002,-3.262518,29.62477,06/24/2002: Rebels attacked three transport vehicles and four tourist vans in the town of Musayni. Eight people were killed and another 19 were injured in the attack.,1,1,1,2,Unknown,8
2002,26.232199,93.975616,06/24/2002: Armed militants with the National Democratic Front of Bodoland (NDFB) and Dima Halao Daoga (DHD) attacked a vehicle convoy of officials from the Oil and Natural Gas Corporation in the village of Dolodoli. Six people were killed in the attack.,1,1,1,2,National Democratic Front of Bodoland (NDFB),6
2002,2.435715,32.623511,06/24/2002: Rebels from the Lord’s Resistance Army (LRA) kidnapped 14 people in the northern Ugandan town of Iceme. The army rescued the captives from the LRA.,1,1,1,6,Lord's Resistance Army (LRA),0
2002,9.603572,41.846497,06/24/2002: A bomb exploded in a building belonging to the Ethiopia-Djibouti railway in the town of Dire Dawa. The Oromo Liberation Front (OLF) has claimed responsibility for the attack.,1,1,1,3,Oromo Liberation Front,0
2002,3.288485,32.87895,06/24/2002: Rebels with the Lord’s Resistance Army (LRA) attacked and killed 4 people in the town of Kitgum in northern Uganda.,1,1,1,1,Lord's Resistance Army (LRA),4
2002,34.526179,74.254614,06/24/2002: A grenade fired into the home of a government official injured 5 Indian army personnel in the town of Kupwara in Kashmir. The official was not harmed.,1,1,1,1,Unknown,0
