iyear,latitude,longitude,summary,crit1,crit2,crit3,attacktype1,gname,nkill2002,1.566527,30.249824,"8/29/2002: Ethnic Hema militia from the Front pour la Reconciliation et la Paix or the Front for Peace and Reconciliation took Human Rights Minister Ntumba Luaba hostage near Bunia, Ituri province, Congo (Kinshasa).  Luaba had been on a mission to find delegates for a peace conference at the time that he was kidnapped; officials stated that he had approached a local chief to invite him to attend the conference and was taken hostage instead.  Three others from Luaba's delegation were also kidnapped.  The abductors demanded the release of at least ten of their own people in return for the ministers' safe return.  All four of the abductees were released on September 1, 2002.  The abduction had been based on a misunderstanding; the ten individuals the militia believed were being held captive were not in custody and were flown back to Bunia in order to facilitate the release of Luaba and his delegation.",1,1,1,6,Front for Peace and Reconciliation (FRP),0
2002,32.925224,75.135264,08/30/2002: Three family members of the Bakarwal community were killed in the Udhampur District’s Malwani hamlet in India. The perpetrators of the attack shot three members of the family. No group claimed responsibility for the shooting.,0,1,1,2,Unknown,3
2002,42.880888,20.867213,"08/30/2002: Unknown assailants hurled a bomb into the yard of Sakib Seljamni’s family home in northern Kosovska Mitrovica, Kosovo, causing material damage but injuring none. No group claimed responsibility for the attack.",1,1,1,3,Unknown,0
2002,23.163957,89.213004,"08/30/2002: Bangladesh opposition leader Sheikh Hasina escaped unhurt when the vehicle she was in came under attack on the way to Jessore, Bangladesh, by alleged supporters of Prime Minister Begum Zia’s ruling Bangladesh Nationalist Party. The government of Bangaldesh did not appear to have a part in organizing the attack. Stones and explosives were hurled at Hasina’s jeep after the attackers had put roadblocks on the road. Some members of Hasina’s convoy were injured in the attack. No group claimed responsibility for the incident.",1,1,1,3,Unknown,0
2002,27.671567,85.316887,"08/30/2002: Unknown attackers threw socket bombs into the Lalitpur Sub-Metropolitan City office in Lalitpur, Nepal. The explosions caused some windows to shatter in the office and in surrounding buildings, but no one was injured in the attack.",1,1,1,3,Unknown,0
2002,27.667004,85.318822,"08/30/2002: Suspected Maoist militants exploded several bombs in Patan, Nepal. One bomb exploded near a Krishna temple as people were heading there to pray, although no one was injured in any of the bombings. No group claimed responsibility for the attacks.",1,1,1,3,Maoists,0
2002,-4.55013,136.889096,"08/31/2002: Unknown gunmen killed three people, including two Americans, and injured at least ten others when they used automatic weapons to ambush a convoy heading towards the U.S.-owned Grasberg gold mine near Timika, Indonesia. Six out of the 10 injured were Americans. The mine's operator, PT Freeport Indonesia, an affiliate of the New Orleans-based Freeport-McMoRan Copper-and-Gold Inc., had often been criticized by human rights advocates for allegedly cooperating with Indonesian security forces in suppressing pro-independence activities. No group claimed responsibility for the attack.",1,1,1,2,Unknown,3
2002,32.193339,35.264836,"08/31/2002: A suspected Palestinian militant opened fire in the Israeli settlement of Har Bracha, a town in the north of the West Bank. The attacker seriously wounded two Israeli settlers before killing himself. The militant group, Popular Front for the Liberation of Palestine (PLFP), claimed responsibility for the attack.",1,1,1,2,Popular Front for the Liberation of Palestine (PFLP),1
2002,35.183333,45.983333,"08/31/2002: An unknown person tried to use a two kilogram TNT bomb to carry out an attack in Halabjah, Iraq. The bomb, however, detonated before the perpetrator could place it, killing him. The target of the attack appeared to have been the headquarters of the Patriotic Union of Kurdistan (PUK) in the Sharazur region. No group claimed responsibility for the failed attack.",1,1,1,3,Unknown,1
2002,33.65,74.288611,"09/01/2002: At approximately 11:30pm local time, unknown perpetrators entered the house of Mohd Qayoom, a Revenue Department official on election duty, in the village of Gounthal, Jammu and Kashmir, India and open fired. The attack killed two of Qayoom’s children, Ruksar Ahmed, 10 and Zaheen Akhter, 12, and seriously wounded one other, Ruksana Kausar, 8. The perpetrators then escaped the scene.",1,1,1,2,Unknown,2
2002,27.666111,85.418889,"09/01/2002: Four suspected Maoist rebels open fired on Radhyashyam Jancche, the President of the Nepal Congress Bhaktapur District Committee, at his house in Chundevi, Nepal. One of the perpetrators involved was killed in the incident, and Jancche was rushed to the hospital for treatment.",1,1,1,1,Maoists,1
2002,1.90967,-75.15906,"1/8/2002: Members of Revolutionary Armed Forces of Colombia (FARC) shot and killed John William Lozano, the mayor of Puerto Rico, Caqueta Department, Colombia.  Two men attacked Lozano as he was leaving the town hall of Puerto Rico, shooting him six times.  He was the first Colombian mayor to be killed in 2002.  Puerto Rico is located next to the rebel-controlled neutral zone.",1,1,1,1,Revolutionary Armed Forces of Colombia (FARC),1
2002,36.417744,1.195033,"9/1/2002: Unknown perpetrators, believed to be affiliated with the Islamic insurgency in Algeria, slit the throats of two Algerian citizens - a father and son - at their home in Abou El-Hacine, Algeria.  It is unknown if the citizens were killed for a specific reason or if the assailants intended to target Algerian civilians at random.",1,1,1,2,Algerian Islamic Extremists,2
2002,36.56522,3.153934,"9/1/2002: Unknown perpetrators, believed to be affiliated with the Islamic insurgency in Algeria, killed three Algerian civilians as they were collecting water at a river near Larbaa, Algeria.  It is unknown if the citizens were killed for a specific reason or if the assailants intended to target Algerian civilians at random.",1,1,1,9,Algerian Islamic Extremists,3
2002,32.225184,35.260989,"2/9/2002: Unidentified Palestinian gunmen in a vehicle opened fire on another vehicle at a junction near Nablus, West Bank, West Bank and Gaza Strip.  An Israeli woman was killed in the attack and her son was injured; her husband was not harmed.  The gunmen escaped to a neighboring Palestinian village.  No group claimed responsibility for the incident.",1,1,1,2,Palestinians,1
2002,34.419539,74.63827,"9/1/2002: Suspected Muslim militants abducted Ghulam Mohammad Bhat from his home in Ayhtmulla village, Jammu and Kashmir, India.  Bhat was a leader of the National Conference (NC).  His decapitated body was found the next day in a field near his village; it took several hours of searching to locate his head in the same area.  The incident occurred two weeks ahead of state elections.",1,1,1,6,Muslim Militants,1
2002,34.188027,74.731146,"9/2/2002: Suspected militants opened fire at a National Conference election rally in Sheikhpora, Jammu and Kashmir, India.  The assailants targeted a motorcade that was transporting Sheikh Mustafa Kamaal, state Industries Minister, after he had addressed the rally.  No one was killed in the attack; however, one National Conference activist was injured and at least one vehicle was damaged.  No group claimed responsibility for the incident, which occurred two weeks before state elections were scheduled to begin.",1,1,1,1,Militants,0
2002,42.37199,-83.467919,"09/09/2002: Members of the Earth Liberation Front (ELF) are suspected of setting arson to a private home under construction at Old Oak Drive in Washtenaw County, Michigan in the United States. There were no casualties reported in the incident; the home was in the early phases of construction, and thus, was completely destroyed by the fire.  The monetary amount or property damage is unknown.",1,1,1,7,Earth Liberation Front (ELF),0
2002,-12.046378,-77.042791,"9/3/2002: Five hooded assailants kidnapped Mariana Pollack, the wife of Adam Pollack, who is an adviser and friend to President Alejandro Toledo, in Lima city, Lima province, Peru.  Pollack was driving late at night when the assailants pulled her over, kidnapped her, and drove off in her car.  The kidnappers have asked for 3 million dollars for her safe release.  Government officials believe that the kidnapping is intended to destabilize the country.",1,1,1,6,Unknown,0
2002,31.617667,65.675942,"09/05/2002: An assassination attempt was made on President Hamid Karzai, when a man wearing an Afghan security uniform stepped out of a crowd and opened fire on his motorcade during a trip to Kandahar, Afghanistan. Mr. Karzai escaped unharmed and the assailant, Abdul Rahman, was immediately killed by the President's American bodyguards. Two other Afghans were killed also in the incident and Governor Gul Agha Sherzai, who was travelling with Karzai, was wounded in the attack. Afghan officials suspected Al Qa`ida in this attack, although no claim of responsibility was made.",1,1,1,1,Al-Qaida,3
2002,6.21663,-75.56671,"9/5/2002: At least two unidentified gunmen on a motorcycle opened fire on a vehicle being driven by Fernando Mancilla as he drove through Medellin, Antioquia Department, Colombia.  Mancilla was killed in the attack.  He had recently been appointed to head Colombia's secret police (DAS) and was scheduled to be formally sworn in just hours after the attack.  Authorities speculate that the attack was perpetrated by the Medellin cocaine cartel, but do not rule out the possibility that it was politically motivated.",0,1,1,1,Gunmen,1
2002,4.5981,-74.07603,"9/5/2002: Alejandro Keipo was shot and killed as he drove his car in Bogoto, Distrito Capital, Colombia.  The gunmen shot him four times then fled.  Keipo was a ""faceless judge""; he tried cases anonymously to avoid reprisals.  No group claimed responsibility for the incident.",0,1,1,1,Gunmen,1
2002,34.533056,69.166111,"9/5/2002: A busy market was bombed in Kabul, Kabul Province, Afghanistan.  A smaller explosion drew curious crowds to the area; the smaller blast was followed by a powerful explosion from a device hidden inside of a taxi.  At least ten people were killed and at least another 65 were wounded.  Vehicles were destroyed and stores were damaged.  The taxi was parked outside of a store selling televisions, a forbidden item under Taliban rule.  Authorities believe that Al-Qa`ida is responsible for the explosion.  Former Prime Minister Hekmatyar had just called for jihad that week.",1,1,1,3,Al-Qaida,10
2002,34.084253,74.504122,"9/5/2002:  Suspected Muslim militants attacked Mustafa Lone, a member of the National Conference ruling party, at his home in Kunzer, Jammu and Kashmir, India.  The assailants stormed into Lone's house, shooting and killing him.  The assailants fled and no group claimed responsibility for the incident.  Violence has been escalating in the lead up to the state elections.",1,1,1,2,Muslim Militants,1
2002,36.30257,2.277702,"9/5/2002: Unknown perpetrators, believed to be affiliated with the Islamic insurgency in Algeria, used a bomb to break into the house of the Zeroual family in Ouled Brahim, Algeria.  The initial explosion killed one member of the family and the assailants proceeded to kill two other individuals at the home.  One of the family members, Roda Zeroual, was able to engage the attackers in a firefight, forcing them to retreat.  Although Roda was shot in the shoulder, he wounded two of the Islamic extremists as well.",1,1,1,3,Algerian Islamic Extremists,3
2002,36.066667,1.133333,"9/5/2002: Suspected members of the Armed Islamic Group (GIA) slit the throats of four individuals near Boukadir, Algeria.  The assailants also took two teenage girls hostage.  The fate of the kidnapped victims remains unknown.",1,1,1,6,Armed Islamic Group (GIA),4
2002,34.015318,74.797339,"9/5/2002:  Suspected Muslim militants shot and killed Mohammed Amin from the People's Democratic Party in Wanabal, Jammu and Kashmir, India.  The assailants knocked on the door of a house belonging to a party candidate, Mohammed Abbas Khan; when Amin opened the door, they shot him.  Police believe the attackers mistook Amin for Khan.  The assailants fled and no group claimed responsibility for the incident.  Violence has been escalating in the lead up to the state elections.",1,1,1,2,Muslim Militants,1
2002,32.8975,74.893056,"09/06/2002: Suspected Islamic militants killed Sheikh Abdul Rahman, a Bahujan Samaj Party candidate for the State Assembly, as well as his driver, Ghulam Mohiuddin Teli, and his nephew, Nazir Ahmad Sheikh. The perpetrators began shooting at the victims as their convoy reached Gori on the Bandpora-Daripora road in Jammu and Kashmir, India. Another nephew of Rahman, Abdul Aziz Sheikh, was injured and later died after being rushed to the hospital. Mohammad Ramzan Sheikh and another person were also injured in the attack. Jamaat-ul Mujahideen claimed responsibility for the incident.",1,1,1,1,Jamiat ul-Mujahedin (JuM),4
2002,15.328695,44.214171,"9/6/2002: A bomb exploded in the Al-Safia neighborhood of Sana'a, Amanat Al Asimah, Yemen.  One person was killed and three more were injured.  The explosion occurred near the finance ministry building.  Authorities did not rule out the possibility that the person killed in the explosion, Ahmad Saleh, was carrying the bomb when it exploded.  No group claimed responsibility for the attack.",1,1,1,3,Unknown,1
2002,42.870022,74.587883,"9/6/2002: An unidentified assailant attempted to assassinate Misir Ashirkulov, the chief of Kyrgyzstan's Security Council, as he returned home in Bishkek, Chuy Province, Kyrgyzstan.  The assailant threw at least two grenades at Ashirkulov as he was getting out of his car; his driver dragged him back into the car before Ashirkulov could suffer more than shrapnel wounds.  The assailant fled and no group claimed responsibility.  Motive is unknown; however, authorities believe the attack was of political character.",1,1,1,3,Unaffiliated Individual(s),0
2002,2.4,33.5,"9/7/2002: Members of Lord's Resistance Army (LRA) attacked villagers in Olilim, Lango sub-region, Uganda.  The assailants looted and burned houses, then abducted at least 28 people from the village.  Specific motives for the abductions are unknown; however, the LRA has abducted numerous children in order to turn them into fighters or sex slaves.",1,1,1,6,Lord's Resistance Army (LRA),
2002,-3.389506,127.980532,"9/8/2002: Gunmen on a speedboat opened fire on the Muslim village of Kulur on Haruku island, Maluku province, Indonesia.  A Muslim woman and two young girls were killed in the shooting.  No group claimed responsibility for the incident.",1,1,1,2,Gunmen,3
2002,33.449444,74.318611,"9/8/2002: Two suspected Muslim militants attacked a Hindu family in Dodasanpai village, Jammu and Kashmir, India.  The militants stormed the family's home and opened fire, killing two women and three men.  Indian officials state that the militants were trained by Pakistan and are motivated to prevent the Indian public from voting in the state elections.",1,1,1,2,Muslim Militants,5
2002,19.075984,72.877656,"9/9/2002: A man from Bombay attempted to hijack an Air Seychelles flight bound for Seychelles from Bombay, Maharashtra state, India.  The plane had already taken off from Bombay when the knife-wielding hijacker attempted to access the cockpit.  The cabin crew seized the man, tying him to a passenger seat until the plane landed in Male, Maldives, and he could be arrested.  One crew member was injured in the scuffle; there were no further injuries.  The motives behind the attempted hijacking are unknown; however, the assailant stated that he wanted to redirect the plane to another location.  Nine other passengers were taken into custody for questioning.",1,1,1,4,Unaffiliated Individual(s),0
2002,3.033333,31.183333,"9/7/2002: Members of Lord's Resistance Army (LRA) attacked villagers in Kuleku, West Nile sub-region, Uganda.  The assailants abducted at least 50 people from the village.  Specific motive is unknown; however, the LRA has abducted numerous children in order to turn them into fighters or sex slaves.",1,1,1,6,Lord's Resistance Army (LRA),
2002,34.526179,74.254614,"09/11/2002: Mushtaq Ahmed Lone, the Kashmir Law Minister, was assassinated at an election rally in Kupwara, India, by suspected Islamic militants.  Security officials said a militant, clad in a burqa and seated in the segregated women's enclosure, took an AK-47 assault rifle from under his robe and opened fire on Lone as he rose to address the rally.  At least two other gunmen in the crowd also opened fire simultaneously, killing the Minister's two bodyguards and wounding the five others, who were standing nearby. All three militants escaped in the ensuing confusion. Lashkar-e-Taiba, Al Barq and Al-Ariseen each claimed responsibility, but the actual party responsible has not been verified.",1,1,1,1,Al-Arifeen,3
2002,8.977146,38.773226,"9/11/2002: An explosion rocked the Hotel Tigray located in Addis Ababa city, Addis Ababa state, Ethiopia.  One woman was killed and another 37 people were injured in the explosion.  Authorities suspect the explosion was caused by a bomb, but are not ruling out the possibility it was caused by the accidental exploding of gas cylinders.  No group claimed responsibility for the incident.",1,1,1,3,Unknown,1
2002,33.639869,74.263416,"9/11/2002: Suspected Muslim rebels opened fire on a bus stand in Surankote, Jammu and Kashmir, India.   Twelve people were killed in the attack, including civilians, police, Border Security Force members, and two of the assailants.  Another 18 people were injured.  The motive behind the attack is unknown; however, the bus stand was located near to an election rally.  Violence in the area has been escalating leading up to the state elections.",1,1,1,2,Muslim Rebels,12
2002,36.532543,3.684417,"9/12/2002: Fifteen members of the Salafist Group for Preaching and Fighting (GSPC) set up a fake roadblock on National Road 5 and shook down Algerian civilians passing through M'rahnia, Algeria.  The assailants intercepted an ambulance carrying a wounded Algerian soldiers and proceeded to slit the soldier's throat before ignited the ambulance on fire.  When an Algerian military patrol arrived on the scene, the Islamic extremists remotely detonated a bomb before fleeing to safety.  Three Algerian soldiers were killed by the blast and nine others were wounded.",1,1,1,3,Salafist Group for Preaching and Fighting (GSPC),4
2002,36.280948,2.104961,"9/13/2002: Around twenty suspected members of the Armed Islamic Group (GIA) ambushed Algerian civilians driving on a road in Bouhdoud, Algeria.  In total, eleven people were killed either by knife or by gun.  Following their deaths, the assailants ignited the bodies and vehicles of the victims on fire.",1,1,1,2,Armed Islamic Group (GIA),11
2002,27.718332,85.325337,"9/15/2002: A bomb exploded in a commercial area in Kathmandu, Bagmati Zone, Nepal.  No one was injured in the explosion.  No group claimed responsibility for the incident; however, the attack occurred the day before a general strike, called for by Maoists, went into effect.   This bomb was one of four that exploded in Kathamandu that day.",1,1,1,3,Unknown,0
2002,2.771679,32.288421,"9/14/2002: Suspected members of the Lord's Resistance Army (LRA) raided the Opiti Roman Catholic mission near Gulu, Acholi sub-region, northern Uganda.  The assailants looted the mission and surrounding settlements, then abducted several people, including two priests.  The rebels released the two priests later that same day, sending them back with a message for the Archbishop; the content of the message is unknown.",1,1,1,6,Lord's Resistance Army (LRA),0
2002,33.733336,75.148983,"09/15/2002: At approximately 12:30pm local time, Jammu and Kashmir Tourism Minister Sakeena Itoo survived an assassination attempt in the Anantnag district of Jammu and Kashmir, India, while on her way to Danev-Kandimarg for an election rally. Unknown militants detonated an improvised explosive device (IED) and open fired on the Minister’s motorcade; one person in the convoy was killed and two others were wounded in the attack.",1,1,1,1,Unknown,1
2002,25.377846,68.346304,"9/15/2002: An improvised explosive device detonated on a Karachi-bound bus that had just left Hyderabad, Sindh province, Pakistan.  One person was killed in the explosion and another five were injured.  No group has claimed responsibility; however, authorities suspect the involvement of Al-Qa`ida militants.  Specific motive is unknown.",1,1,1,3,Al-Qaida,1
2002,2.553629,128.610928,"9/15/2002: A group of unidentified gunmen attacked the village of Pangeo on Morotai Island, North Maluku province, Indonesia.  One person was killed, a dozen more were injured and numerous residential and religious buildings were burned.  Pangeo was one of three villages attacked that day by the gunmen; Muslims and Christians live together in all three villages, which is atypical in the Maluku islands.  Specific motive is unknown; however, the attack is believed to be sectarian.  No group has claimed responsibility for the attack.",1,1,1,2,Gunmen,0.666666667
2002,27.718332,85.325337,"9/15/2002: A bomb exploded in a commercial area in Kathmandu, Bagmati Zone, Nepal.  No one was injured in the explosion.  No group claimed responsibility for the incident; however, the attack occurred the day before a general strike, called for by Maoists, went into effect.   This bomb was one of four that exploded in Kathamandu that day.",1,1,1,3,Unknown,0
2002,27.718332,85.325337,"9/15/2002: A bomb exploded in a commercial area in Kathmandu, Bagmati Zone, Nepal.  No one was injured in the explosion.  No group claimed responsibility for the incident; however, the attack occurred the day before a general strike, called for by Maoists, went into effect.   This bomb was one of four that exploded in Kathamandu that day.",1,1,1,3,Unknown,0
2002,27.718332,85.325337,"9/15/2002: A bomb exploded in a commercial area in Kathmandu, Bagmati Zone, Nepal.  No one was injured in the explosion.  No group claimed responsibility for the incident; however, the attack occurred the day before a general strike, called for by Maoists, went into effect.   This bomb was one of four that exploded in Kathamandu that day.",1,1,1,3,Unknown,0
2002,2.495129,128.637253,"9/15/2002: A group of unidentified gunmen attacked the village of Korago on Morotai Island, North Maluku province, Indonesia.  One person was killed, a dozen more were injured and numerous residential and religious buildings were burned.  Pangeo was one of three villages attacked that day by the gunmen; Muslims and Christians live together in all three villages, which is atypical in the Maluku islands.  Specific motive is unknown; however, the attack is believed to be sectarian.  No group has claimed responsibility for the attack.",1,1,1,2,Gunmen,0.666666667
2002,0.783333,127.366667,"9/15/2002: A group of unidentified gunmen attacked the village of Losuo on Morotai Island, North Maluku province, Indonesia.  One person was killed, a dozen more were injured and numerous residential and religious buildings were burned.  Pangeo was one of three villages attacked that day by the gunmen; Muslims and Christians live together in all three villages, which is atypical in the Maluku islands.  Specific motive is unknown; however, the attack is believed to be sectarian.  No group has claimed responsibility for the attack.",1,1,1,2,Gunmen,0.666666667
2002,43.316667,45.683333,"9/16/2002: A remote-controlled landmine detonated near a central market in Grozny, Chechnya, Russia.  The device exploded as a bus passed by; 18 people were killed and many others were injured.  Two armored personnel carriers had just passed by at the time of the explosion and authorities believe they may have been the intended target.  No group has claimed responsibility for the incident, although officials blame Chechen rebels for the attack.",1,1,1,3,Rebels,18
2002,-33.469115,-70.641997,"9/16/2002: A small improvised explosive device detonated at an air force installation in Santiago, Santiago province, Chile.  One person suffered acoustic trauma as a result of the explosion and several windows were broken.  No group claimed responsibility for the incident and the motive is unknown.",1,1,0,3,Unknown,0
2002,34.086149,74.515567,"9/16/2002: A bomb exploded near a polling station in Batpora, Jammu and Kashmir, India.  Two men were wounded in the explosion; it is unknown whether they were voters or passers-by.  No group claimed responsibility; however, authorities believe that militants are responsible for the incident.  Separatist Muslim militants have threatened to escalate violence in order to derail the election process.",1,1,1,3,Militants,0
2002,31.444146,35.090312,"9/17/2002: A bomb exploded at Zayf Elementary School in Yatta, West Bank, West Bank and Gaza Strip.  Five children were wounded in the explosion.  In the aftermath of the explosion, security officials also found a second bomb at the school and control-detonated it.  No group claimed responsibility for the incident; however, authorities suspect that extremist Jewish settlers were responsible.",1,1,1,3,Extremists,0
2002,54.597269,-5.930109,"9/17/2002:  Two pipe bombs were thrown through the window of a Catholic home in North Belfast, County Antrim, Northern Ireland.  A mother and her two children who were in the house escaped injury.  No group claimed responsibility for the incident.",1,1,1,3,Unknown,0
